Question,Subj_Q,Answer,Subj_A,Domain
تفسير منطقي من فضلكم   هل توفير نسخة مجانية يقلل مبيعات النسخة المدفوعة,0,وعليكم السلام توف ر النسخة المجانية من أي منتج لا يعني أنك ستخسر المبيعات من النسخة المدفوعة  بل هي خطة تسويقية جيدة جدا  لجلب الع ملاء الجاديين والمحترمين للشراء منك في الواقع ليس عليك أن تتمادى وتوفر ن سخ مجانية من ك ل منتج مدفوع  لأن هكذا سيعتمد الناس  أو  سينتظر الناس  إصدارك للنسخة المجانية من أي منتوج أكثر من المدفوع لذلك إن كان لديك مثلا  12 منتج  مثلا  قالب وورد بريس   فأجعل 6 أو 5 نسخ منها لديها نسختين واحدة مدفوعة والأخرى مجانية  وأجعل المدفوعة بسعر زهيد  رخيص  وليس رخيص جدا  آخيرا  نصيحة بسيطة  بالنسبة للنسخة المجانية أجعل مميزاتها 30 أو 35  بالكثير بالنسبة للنسخة المدفوعة  أي أنك لن ت ضحي بوقتك كله من أجل لا شيء  في النهاية من يعجبه منتوجك سيشتري منك  وأنصحك أن ت لغي الدعم الفني بالنسبة للنسخ المجانية  إذا كان هنالك دعم   وأجعل دعم النسخ المدفوعة أكثر لكي يرتاح لك الزبون ويشتري منك وهو م طمئن بجودة الم نتج بالتوفيق ,0,التسويق الالكتروني
مالفرق بين الشركة التسويقية والمسوق الذي يعمل لوحده ,0,موضوع مهم وتمنيت لو أن الحسوبيين تفاعلوا مع الموضوع وناقشوا فيه,1,التسويق الالكتروني
تخلص من مدونتك  لماذا المشاريع الجانبية هي مستقبل التسويق   اختراق النمو   أكاديمية حسوب,0,بطبيعة الحال أخي الكريم  فالتسويق إبداع في حد ذاته فرجل التسويق يعمل على رفع الكفاءة وتنمية المشاريع ودفعها إلى الأمام وتظهر مهارته جليا في المشاريع الجانبية  والله أدرى وأعلمتعديل   أخطأت في الموضوع,1,التسويق الالكتروني
كيف أبهر تشيلسي رؤساء الشركات ليحصل على ثاني أكبر عقد رعاية,0,عند اللحظات الأخيرة من الفيديو تساءلت كيف لو قبلوا الجميع ولكن تراجعت فيبدو أنها ستكون مستحيلة,0,التسويق الالكتروني
ما هي بعض الأشياء التي تفعلها أمازون والتي يمكن أن تفاجئ الناس العاديين  ,0,ليس غريبا  على أمازون فهي تنفق معظم ميزانية تسويقها على خدمة الزبائن واسعادهم بدلا  من الاعلانات  لا اذكر أن شخصا  اشترى من أمازون وحصلت معه مشكلة ولم يخرج سعيدا ,0,التسويق الالكتروني
كورسي  سيو المدونات و جوجل ادسنس    كيف انجح بالاعلان عنه,0,بداية دعني استغرب قليل ا انك ستقدم كورس عن ال SEO ولاتستطيع ابتكار نموذج لترويجة بخصوص التسويق للكورس انت لست بحاجة للكثير من التعقيدات ولا تفكر في سعر الكورس في الوقت الراهن بل فكر بكيفية تقديم هذا الكورس والمحتوى الخاص به  ما هي المواضيع التي ستتطرق لها اكتب خطة الكورس الخاصة بك  ضع نفسك في مكان الشخص الذي سيستفيد من الكورس  ما هي اهم المواضيع التي يرد منك تغطيتها  ماهي الجوانب التي يحتاج مزيد من الايضاح فيها  بالاضافة مثلا لبعض اساسيات الHtmlألتي تلزم في اعدادت الSEO ابدأ بعمل بحث استقصائي انشره بين الافراد المهتمين  اسئلهم من خلاله عن توقعاتهم ومالذي يريدونه فعلا من هكذا كورس   بخصوص التسويق عليك بعمل موقع الكتروني وتبدأ بتجهيزه من اللحظه واستهدف به اهم الكلمات التي يستخدمها الافراد المهتمين بكورس SEO الموضوع لن يكون صعب طالما لك7 سنوات خبرة اي انك اكثر مني خبرة  D   وطبع ا لا ننسى اهمية مواقع التواصل الاجتماعي في النهاية موضوع السعر لا تفكر ابد ا باستراتيجية خفض السعر طالما تثق بجودة المحتوى الذي ستقدمة ومن واقع تجارب ومشاهدات كل ما قل السعر قل اهتممامي واقتناعي بجودة المحتوى  فلن يبيع لي احدهم خبرة 7 سنوات مقابل 10  مثلا ولو لاحظة على يودمي بعد مدة يتم عمل خفض للاسعار وليس مباشرة طبعا في حالة كانت هذه الكورسات ذات محتوى يستحق واصحابها لهم خبرة فعلا   عليم ان تعرف بنفسك فشخص بخبرتك لابد ان له جمهور يعرفه من خلال الموقع ضع رابط اشتراك بقائمة بريدية لمن هو مهتم باستلام اخبار عن اطلاق الكورس اتمنى ان اكون افدتك    تحياتي   ,1,التسويق الالكتروني
شركتى كانت لها سمعة جيدة فى سوق الاستضافة والبرمجة كيف استعيد الثقة,0,يوجد لديك قصة شركة السيتامول كمثال  وهي شركة فقدت الثقة ثم استعادتها باستخدام أسلوب أصبح يسمى باسمها  والقصة باختصار هي أن خطأ  حصل في المنتج فتسبب بمقتل 6 أشخاص تقريبا  بعد استخدامهم الدواء  فانتشر الخبر في الصحف قبل الشركة حتى  وقد اتصل صحفي ليعلم الشركة بهذا ويطلب تفاصيلا   عموما   ما قامت به االشركة هو كبداية تلقي الإنتقادات بصدر رحب  ثم قامت بتعويض عائلات المتضررين ونشر هذا الخبر لتكسب تفاعلا  عاطفيا  شيئا  ما  علما  أن اول ما قامت به هي سحب جميع منتجاتها لإثبات الإهتمام  ثم أعلنت عن دراسة الموضوع وصمتت لفترة ثم عادت بعد الهدوء بإطلاق منتج جديد معدل وآمن مع حملة تسويقية كبيرة  فاستعادت الثقة والنجاح من هذه القصة أستخلص لك رغم الاختلاف قليلا  في المشكلة بعض النصائح إياك ورد النقد  تقبله وتفاعل معه واستمع بآذان صاغية  تفهم حتى الهجوم الشخصي  لا تقابل  استوعب الهجمات عليك أظهر اهتمامك  استمع لآراء المستخدمين وأجبهم بسرعة مع إظهار حب كبير  لا تقل للانتقادات   سيتم نقل رأيك إلى المختصين  بل قل  اقتراح جميل  نحن في شركة فلان مهتمون بسماع رأيك يا فلان تأكد من ذكر اسمه الأول فقط  لا تذكر نفس الاسم الذي تعرفونه عنه  بدلا  من زيد إدريس نقول زيد   ما سنفعله بخصوص هذا الاقتراح هو  محاسبة المقصرين  متابعة الخطأ  نقل الاقتراح إلخ    ولو استطعت تقديم مهلة لتصحيح الوضع خلالها فأنت محظوظ  ربط المستخدم المنزعج بوقت معقول هو أكثر ما سيخمد غضبه ويحوله لتحد  إن فزت فيه انتقل إلى حبك بجنون مع الدفاع عنك وذكر قصتك في بعض الحالات  اصمت فحسب   ليس من الضروري أن تعبر وتدافع وتقابل وتهاجم  حين يكون الهجوم قويا  أخرج رسالة واحدة تشرح بها ما ستفعله خلال كلمات قصيرة واختبئ عن الأنظر حتى تنهض بجديد وتعلن عنه مرة أخرى حاول مرة أخرى بشكل جديد  إن ساء الوضع تماما   ابدء تغييرا  جذريا   غير الموظفين واسم الشركة وبعض صفات المنتج وتصاميمه  ثم انتقل إلى صفحة جديدة وابدأ إذا قمت بتعديل جديد  أرسل رسالة لطالبي التعديل بالاسم الأول تشرح لهم مدى اهتمامك وتدلل على ذلك بالتعديل هذا ما لدي الآن  عموما   فقط ضع نفسك مكان المتضرر  توقع ردة الفعل لكل فعل تقوم به قبل إتيانه  وتوكل على الله عسى يوفقك إلى رزق جديد ,0,التسويق الالكتروني
ما رأيك في هذه المقولة   ليس لديك موقع على الانترنت  إذا  أنت غير موجود  ,0,ربما بالنسبة للشركات المتوسطة والكبيرة هذا صحيح  لكن ليس دائم ا  مثلا سلسلة مطاعم البيك مشهورة جد ا دون أن تملك وجود ا على الإنترنت  مع ذلك أظن أن البيك هو أحد استثنائات القاعدة ,0,التسويق الالكتروني
امنعوا هذان الموقعان من الاعلان في موقعكم,0,جزاك الله خيرا ,1,التسويق الالكتروني
في عنوان المقالة أوالمقد مة هل يأثر إستعمال الحركات              أو الشدة       سلبا على SEO  ,0,النقطة التي أثرتها م هم ة للغاية  حقيقة أنا من أنصار الفتحة والشد ة والضم ة وم تعو د على الكتابة وفق النمط الذي يحتوي تشكيل  لذا فإن هذا الموضوع أثارني ودفعني للتجريب والتدقيق خلال فترة من الفترات  لأنه من المنطقي أن ينتبه كل م دو ن على الانترنت لهذا الأمر ما خلصت إليه هو عدم تأث ر جوجل بوجود التشكيل من عدمه في نتائج البحث باللغة العربية  وبالتالي فإن وجود التشكيل لن يؤث ر على البحث  كما أنه لن ي قد م قيمة م ضافة إلى نتائج البحث كذلك أيض ا وفي سياق النصيحة  ومن خلال تدقيقي بالكلمات البحثية لزوار المواقع التي أشرف عليها لاحظت  للأسف  أن كثير ا من الزوار العرب يبحثون عبر جوجل باستخدام اللفظ الانجليزي باللغة العربية   على سبيل المثال  مراجعة هاتف galaxy s6 edge plus    تجدهم يكتبونها  مراجعة هاتف جالاكسي اس 6 ايدج بلس   المعروف بحسب سلامة اللغة والع رف الم ت بع أنه حينما تود كتابة اسم شركة أو م نتج يجب أن تكتبه بلغته كما هو باستثناء إن ورد تعريب رسمي له من المصدر  مثل  مايكروسوفت   لكن بحث الأشخاص بهذا الشكل جعلني أتجاوز ذلك بشكل  بسيط بحيث أوج ه إلى فريق العمل بأنه لا بأس بإدراج تسمية الم نتج ولو لمرة واحدة في سياق المقال بشكل عربي منطوق أتمنى أن تكون الفكرة قد وصلت  وتمنياتي لك بالتوفيق ,0,التسويق الالكتروني
هل تحتاج أي مساعدة في مجال التسويق الالكتروني  لا تتردد أنا هنا    ,0,شكرا لك  على المبادرة الطيبة  أتمنى تتبعها مبادرات أخرى من هذا المجتمع الر ائع أنا أحتاج إلى إستشارة في هذا المجال سأرسل لك  الت فاصيل في الر سائل الخاص ة ,1,التسويق الالكتروني
كيف تنشئ إعلانا  فع الا  على الإنترنت,0,حقا  مقال جميل جدا        ,1,التسويق الالكتروني
لماذا لا يوجد شريف يقدم خدمات الباي بال و الفيزا و الكاشيو في سوريا  ,0,لأنه لو وجد أمين فلن ي سمح له ولن  ي عطى ترخيص لمزاولة ذلك ,1,التسويق الالكتروني
لماذا نجح اعلان الواتس آب حينما فشل الاعلان الممول على فيس بوك  ,0,أنت تعلم أنه في السعودية الفيسبوك هو الأقل انتشار ا بين الشبكات الجتماعية ربما هذا هو السبب,0,التسويق الالكتروني
كيفية توثيق حساب على Twitter,0,تواصل معهم عبر هذا الايميل اشرح بالتفصيل عن شركتك وضع عدة نماذج تقليد  يعني العب على وتر ان هنالك من يحاول تقليد البراند الخاص بك  menaverifications twitter com,1,التسويق الالكتروني
ما رأيكم بإنشاء موقع يهتم بإحصائيات التسويق الإلكتروني للمنطقة  ,0,هل الاحصائيات ستأتي مباشرة من مواقع التجارة الالكترونية ام ستكون من المصادر الاخبارية ,0,التسويق الالكتروني
2 مواقع أربح منهما نصف دولار في الشهر عبر جوجل أدسنس ماذا تنصحني  ,0,أعطنا روابط مواقعك لمعرفة السبب في قلة الربح ,0,التسويق الالكتروني
على ماذا يدل لوغو VISA في كارد بنكي ,0,على ما اظن يدل على استطاعتك من سحب او دفع من بطاقتك في اي صرافة الية او وسيلة دفع تعتمد VISA  ويمكنك ايضا الشراء من الانترنت بالبطاقة نفسها في غالب المواقع التي تدعم بلدك ,1,التسويق الالكتروني
ايهما افضل للتسويق لمنتجي من اجل حصد افضل النتائج ,0,اسف الروابط الاولى غير شغالة كما قال لي بعض الاخوة لانه ربما الصورة التي رفعتها من خلال دربوكس لي انا فقط الصلاحيات لرؤيتها وهاته هي الروابط الشغالة وشكرا الشكل الاول  الشكل الثاني   عموما كلا التصميمن غير كاملين نظرا للحيرة لذلك اردت ان استشيركم,1,التسويق الالكتروني
  للنقاش   زوار كثيرين ودخل منخفض   أين المشكلة  ,0,هناك عوامل كثيرة منها  الزوار المستهدفين  المواقع التى تستهدف العرب عموما اسعارها أقل والموضوع يختلف أيضا هل تستهدف الخليج مثلا أو شمال أفريقيا   مصادر الزيارات  كلما كانت من محرك البحث كلما كانت فرص تحقيق الدخل أفضل   موضع الاعلان وحجمه وملائمته للأجهزة التى يدخل منها الزائر  ,1,التسويق الالكتروني
هل هناك مثل هذا الموقع بالعربى ,0,الفكرة ظهرت بداية الألفية الحالية  حينها اشتهرت وكسب منها أصحابها مبالغ خيالية  بعد فترة اكتشف الكل الخدعة بخيبة أمل كبيرة  فالإعلانات في مثل هذه الصفحة ليست جذابة ولا تدعوك للضغط عليها إلا على سبيل الفضول والتجربة    عربي   حسنا  قلدها كثيرون حينها وأنا منهم   لكن الآن لا أدري أيوجد مشروع مثلها على قيد الحياة فقط لعلمك  كان يوجد برنامج  سكربت  يقدم نفس الفكرة والعرض ,1,التسويق الالكتروني
ما هو افضل كتاب عربي تنصحوني به لتعلم التسويق الالكتروني للمتدئين  ,1,لن تجد مثل هذا الكتاب  لأنه ببساطة حتى يفرغ الكاتب منه تكون المعلومات التي فيه أصبحت قديمة    وخاصة أنك تطلب الكتاب عربيا    فالعرب المهتمين بالتسويق الالكتروني اما أكاديميين يبحثون عن التنظير أو هواة لايعملون بأساس احترافي    والشخص المحترف الجيد لاوقت له لعمل مثل هذا الكتاب لأن وقته ثمين,1,التسويق الالكتروني
اقدم لكم تجربتي عن تأثير النشر على شبكة جوجل بلس,0,هل  قمت  بحملة اعلانية ام  اعتمدت  على  الحساب  الخاص  و المجموعات    ,0,التسويق الالكتروني
عندما أريد أن أنشئ حملة إعلانية لموقع ما  ما هي أفضل الحلول   وهل إعلانات حسوب وأرباح  ترايدنت  جيدة ,1,أهلا  أخي كمعلن أنصحك باستخدام حسوب قمت بتجربة الاثنين  إعلانات جوجل وحسوب وللأمانة وكتجربة شخصية أنا استفدت من تجربتي مع حسوب أكثر من جوجل تمنياتي لك بالتوفيق ,0,التسويق الالكتروني
تجاربكم في إستخلاص الأرباح من أمازون,0,  التحويل المباشر  هو أفضل و أضمن و أرخص طريقة للسحب من أمازون  و بالطبع ستحتاج لحساب Payoneer لتسهيل الأمر  أما الاستلام بالشيك فيكلف كثيرا و البنوك تأخذ عمولات مرتفعه جدا لتخليصه لك  إلى جانب أن الشيك يصل خلال 15 20 يوم عبر البريد  و لاتنسى الأخطار التي تحيط بضياعه أو سرقته  Payoneer توفر لمستخدميها حسابات بنكية أمريكية من Bank Of America  ما عليك إلا تفعيل خاصية  My US Payment Service  في حسابك عن طريق ارسال المستندات المطلوبة  و من ثم ستتمكن من استلام أرباحك من أمازون  و منه مباشرة إلى بطاقة ماستر كارد بايونيير التي يمكنك استخدامها في سحب أموالك من أقرب ATM ,0,التسويق الالكتروني
انستغرام و تحقيق ربح مادي منه عربيا,0,أهلا  أخ معاذلم استخدم انستقرام في البيع  ولكنني سبق وأن اشتريت عبر الانستقرام وأعرف أصدقاء يبيعون بضائع عبر الانستقرام بالنسبة للعوائد المادية  للأمر الذي اتحدث عنه  ليست من الدعاية أو التصوير  بل هو استخدام انستقرام كمتجر إلكتروني أعتقد أن هناك أفكار كثيرة جميلة تتعلق بانستقرام  وقد تكون مربحة ماديا  إذا ما طبقت بشكل مناسب أعمل أنا وأحد الأصدقاء الآن على مشروع بسيط  هو أقرب للفكرة البسيطة منها للمشروع   والتي تستهدف بالمقام الأول مستخدمي انستقرام وسترى النور قريبا  بإذن الله  وآمل أن ننجح بإذن الله أقول هذا الكلام لتشجيعك لتبدأ بفكرة تستهدف الانستقراميين وستنجح بإذن الله إذا ما ابتعدت عن موضوع بيع الإعجابات والمتابعين وما شابه ,0,التسويق الالكتروني
ما هي حقيقة بيع اعجابات الفيس بوك و المواقع الاجتماعية  ,0,اضف الى هذا زيادة عدد الاعجابات بالصفحات تزيد من سعر الاعلان للصفحة عموما  حتى الاعلان في فيسبوك حوله شبهة وها الفيديو  ويتحدث عن بيع الاعجابات ملاحظة  هنالك ترجمة بالعربي  اضغط CC واخترا اللغة من قائمة الخيارات ,0,التسويق الالكتروني
ما هي أساسيات دراسة السوق ,0,مقالتي هذه قد تفيدك      ما هي أنواع بحوث التسويق و كيف تعد بحثا  ناجحا      مدونة ناسداك  www mhabash com 2013 11 27  D8 A    ما هي أنواع البحوث التي يجب أخذها بعين الاعتبار   بحوث استطلاعية Reporting research  تزود بالتقارير     ما هي أنواع البحوث التي يجب أخذها بعين الاعتبار   بحوث استطلاعية Reporting research  تزود بالتقارير,0,التسويق الالكتروني
ماهي افضل طرق التسويق الالكتروني,1,في اعتقادي احد افضل طرق التسويق هو التركيز على مستخدمين في منصة معينة مثل تويتر او انستقرام يعتمد على طبيعة مشروعك و من ثم التعرف اكثر على تفاعل المستخدمين في تلك المنصة و لا تنسى ان هناك توجة في عالم التسويق و هو  نوع من انواع التسويق يستثمر عنصر  العاطفة للترويج لمنتجك و ان التسويق بات يتعلق بعواطف الناس اكثر من تفكيرهم  و اقامة علاقة مع الزبائن و المتابعين اشبه بعلاقتك مع الاصدقاء و الاصحاب  ,1,التسويق الالكتروني
14 نصيحة لمدراء ومسؤولي الشبكات الاجتماعية   عمر خرسه,0,شكرا  لك أخي عمر على النصائح المفيدة ومشاركة خبراتك كنصيحة إضافية بسيطة أرى أن استخدام الصور مع الروابط لتحفيز المستخدم على الضغط على الرابط يعطي نتائج إيجابية دائما  مقارنة بمشاركة النصوص فقط مع الروابط عن تجربة بالنسبة لنصيحة الطواريء  رقم 11  هل هناك أداة تنصح باستخدامها لجدولة المنشورات باستثناء Hootsuite التي تجبرك على الاشتراك المادي معهم في حال أردت استخدام Pic twitter لرفع الصور بالنسبة لتويتر ,1,التسويق الالكتروني
عرب ايدول _ حكاية تسويقية مرسومة بحنكة عباقرة,1,كل شخص له الحق في التسويق لمنتجه  كما تفعل الان أبل مع منتجاتها مع ان يوجد افضل منها و ارخص و لكن التسويق الذكي يعمي الناس عن الحقيقة ,1,التسويق الالكتروني
إن كان لديك برمجيات وتريد أنزالها فى السوق فهل تعرضها فى بأسمك الشخصى أم بأسم شركتك   ,0,بالنسبة لي افضل ان اعرض كل منتجاتي باسم الشركة لان بهدا تبني سمعة الشركة و ايضا تاسس لاسمها في الميدان و السوق ككلوايضا الركة تعطي قيمة اكتر للعمل,1,التسويق الالكتروني
