Question,Subj_Q,Answer,Subj_A,Domain
هل من الممكن أن تكون على قيد الحياة ولكن ميت   ,1,سألت سؤالا  هاما  يا رياض   لكن المشكلة تكمن في الإجابة  كثيرون هم الأشخاص الذين يصلح معهم إطلاق أحكامنا عليهم بأنهم يسكنون دائرة الموت   المشكلة أنهم أنفسهم لا يرغبون الخروج من تلك الدائرة أبدا    مثل هؤلاء كيف لنا أن نحمل العبء عنهم وهم أنفسهم لا يأبهون بالأمر بل قد يقاومون محاولاتنا في مساعدتهم ويظنونها تطفلا  على حياتهم وفرضا  لسيطرتنا على تلك الحياة أما أولئك الذين يسعون لتطوير ذواتهم  ويراقبون تفاصيل حياتهم ليقيسوا حجم إنجازاتهم فمثل هؤلاء لسن بالحاجة للقلق عليهم  لأنهم سيحدثون ذلك الزلزال القادر على إخراجهم من منطقة الراحة التي يعيشون فيها  ولو بخلق ظروف صغيرة تجعل لحياتهم ميزة التجربة والتغيير هل الخروج من منطقة الراحة مخيف يعتمد الأمر باعتقادي على مدى رغبتنا في التغيير وإيجاد هدف حقيقي يستحق النضال لأجله ,1,ثقافة
عندما يتمدد العقل لاستيعاب فكرة جديدة لا يعود أبدا  إلى حجمه الطبيعي ,1,ذات مرة كنا نتناقش ومجموعة من الزملاء حول أسباب فشل العلاقات الزوجية التي تتم بسن متأخرة  حيث ناقشنا فكرة أن  أغلب العلاقات المتشكلة بمراحل متأخرة من العمر أشبه ما تكون بمحاولة تشكيل قطعة صلصال جافة  فاستخدام الصلصال الطازج سيكون سهل العجن والتشكيل كما يتقبل إضافة مكونات جديدة إليه  لكن الأمر لا يكون كذلك أبدا  للصلصال القديم  نوعا  ما  لذلك قد تستمر بعض العلاقات التي تبدأ بمرحلة صغيرة لأن  العقول حينها قابلة لتغيير معطياتها وأفكارها  في حين يكون الأمر صعبا  في المراحل المتقدمة لأن  الخبرات والشخصيات تشكل ت ضمن استقلالية أكبر ذات الأمر ما أظنه يحدث مع العقل  في المراحل الصغيرة  تكون مساحات العقل أكثر اتساعا  بأقل عدد من الاهتمامات والأولويات والمشاكل التي تحتل جزءا  كبيرا  من التفكير  لذلك يكون سهلا  أن نخزن المعلومات صغارا   وأن نترك مساحات شاسعة للخيال والمعرفة  ولكن كلما كبرنا  زادت تجاربنا  أولوياتنا  مشاكلنا  مسئولياتنا  فتبدأ تلك المساحات في الدماغ بالتقل ص نتيجة استغلالها من أفكار أخرى متعددة لذلك قد يكون هذا سببا  في تأخر القدرة على التعل م وليس في تراجعها   فمن السهل تعليم طفل صغير كيف يستخدم مفاتيح البيانو ويقرأ نوتة موسيقية والأمر ليس مستحيلا  للكبير لكنه سيحتاج لأضعاف الوقت لأن  المعرفة تشكلت والمساحات في العقل أصبحت شبه محجوزة أما الوصول لحالة الإشباع وعدم تقب ل أي فكرة جديدة  فلا أعتقد بأن  المسألة متعلقة بمقدرة العقل على الاستقبال بقدر ما هي مربوطة بقدرة العادات وسيطرتها على تبديل المعارف وتعديلها   فالعقل كما أسلفت  زينا قابل للتمدد  لكن التجاوب والقدرة على تنويع المعارف عائد لمدى ثقافة المرء وتقب له لتغيير عاداته وقناعاته ,1,ثقافة
حصان النادي و حمار المزرعة   تمنيت حقا أن ت خبراني بمشاعركما ,1,أما أن يسعى الأنيس للحياة الحر ة  ويسعى الحمار المسكين لحياة تشبه ذلك الأنيس فهي مسألة لا أتخيلها أبدا   وربما أجدني في جزمي ذلك أتذكر قصة قيلت على أسماعي مر ة بدأها قائلها  لم  تأبى أسود الأقفاص العيش في العراء رغم أننا جاهدنا لنضع إجابات محتملة إلا أن إجابة السائل كانت بأن  تلك الأسود التي ولدت بين القضبان لم تعرف حياة لنفسها خارجها  لذلك ستكون هش ة ضعيفة خارج تلك الأقفاص في حين تشعر بقو تها وهي بين جنباته بدا المبرر مقنعا    كيف تعل مه نمط حياة ثم تطلب منه تغييره  سيكون الأمر كصدمة لن يتمكن عقله المعتاد من تقب لها  الأمر أشبه بذلك الحمار الذي أحب صاحبه تدليله فأخذه لسقف المنزل ليراقب غروب الشمس   وحين ألفها وأراد صاحبه إنزاله رفض الحمار وبعد مناوشات بينه وبين صاحبه صار يهرول على السقف حتى انهار على أهل الدار  فقال صاحب الدار قولته التي ذهبت مثلا   الحق  ليس  عليك    لأن مكانك تحت بآخر البيت  الحق علي  أنا الذ ي رفعتك إلى السطح  ,1,ثقافة
هل أفاد نموذج الربح من  الاعلانات المحتوى على الانترنت ,0,التربح من الإعلانات على يوتيوب أدى إلى زيادة كمية المحتوى بشكل هائل  ولكن على حساب الجودة والقيمة وحتى التنوع  فهناك كثير من المحتوى المتشابه والمنسوخ وكله يحصد المشاهدات ويدر  الأرباح  النموذج البديل الذي أشار إليه علي أفضل وأرقى ولكنه كان يحتاج إلى ما يعزز  الاستدامة  له كنموذج ,1,ثقافة
 إن من أشجع القرارات التي تتخذها في حياتك هي أن تتخلى نهائي ا عن كل ما يؤذي قلبك ,1,هذا يمثلني تماما  هل تعلمين أشعر دائما بأن هناك من يتلصص نجاحي وينتظر سقوطي ولا تمنى لي الخير    يقولون ان الأكثر سوءا هم الأقرب منها  أنا أؤمن بذلك  لأن البعيد عنا لا يعرف الكثير عن تفاصيلنا ولا يخالطنا ولا يحسدنا كما القريب الذذي يتمنى زوال النعمة وبل فشلنا وقهرنا وحتى موتنا بالصرعة النفسية القاهرة ولكن ماذا افعل    اول شيء  كل عائد يدخل علي   لابد ان يكون هناك جزء منه لمن يستحقونه من الفقراء والمساكين الذي حقا سيدعون لنا ويكونوا درعا لحياتنا  لاصنعوا دروعكم بالصدقات واحصنتكم بالعمل الصالح اجعلوا لمن يحتاجون نصيبا من طعامكم ومشربكم ومالكم حتى تسلموا من اعداء النعمة ,1,ثقافة
 ليست الأشيـاء هي ما ي ـشـقـي الناس  بل فـكـرتـهـم عن الأشيـاء  ,1,بالتأكيد  وأنا أجنح دائم ا إلى أن ذاكرتنا تعمل بهذه الكيفية أيض ا  حيث أن الأشياء تسكن في دواخلنا كما نتذك رها  لا كما هي  ومن هذا المنطلق أظن أن الإنسان بشكل عام اكتسبه تكوينه النفسي والذهني  حيث أنه تبع ا لطبيعته البيولوجية اعتمد في نهاية المطاف على أن ينظر إلى العالم بعينيه هو  لا لشيء  إل ا لأنها الحيلة الوحيدة التي يمتلكها  وعليه فإن الإنسان اعتمد في هذه النظرة على تصو ره  وقد استلهم من هنا قديم ا الفيلسوف الإغريقي أفلاطون فكرته عن مفهوم التصو ر المجر د  فرأى أن وجود الحصان مثل ا يعتمد على صورتين  صورة ذهنية مشتركة بيننا جميع ا حول طبيعة الحصان وشكله المثاله  وصورة واقعية بمجر د أن يراها الإنسان يطابقها بالصورة الأولى ويقارن بينهما ,1,ثقافة
تشعر بقلق قرب فتاة  اجابة علم النفس التطوري,0,بخصوص الأمر المتعلق بالقلق  الذي يرافق الاقتراب من الفتيات  بالإضافة إلى ما ذكره من أسباب ضف على ذلك عدم معرفة ما يريده الفتى وما هو مبتغاه من الزواج أصلا فتارة يقول انه يريدها متعلمة مرة أخرى موظفة مرة أخرى فائقة الجمال ويضع تفاصيل معقدة إلى حد ما هذا من شأنه يؤدي  الي تقليل حالات التزواج وصعوبة إيجاد مبتغاه  وبالتالي عدم التوفيق بينهما وهنا أشير أن الكمال لله وحده وعليه أن ينظر إلى الثوابت وليس المتغيرات الثوابت هنا خلقها وعلمها وأدبها والمتغيرات الجمال مثلا باعتباره أمر نسبي    كما أنني سأعقب على أخر عبارة قيلت  وصو  ب نحو فتاة ليست أعلى منك جاه ا ومكانة  وستجد القلق قد قل   من تلقاء نفسه   نعم صحيح يجب أن تبحث على من يشبهك ليكملك وليس أقل أو على منك هي حياة مفتوحة وطويلة فالاختيار الحسن أمر ضروري ,1,ثقافة
مسألة اختيار و قرار   قطعة سكر مستسلمة و نحلة متهورة   أي واحد أنت فيهما ,1,نص جميل كلنا نحب المغامرة ونرغب دائما  في التغيير النحلة رأت أن الفنجان مكان آخر ومتنفس لها حتى لو إنها قد تذوب فيه هي بحثت ووجودت أن الكأس مناسب وأيضا  قطعت السكر حكمت على نفسها بالذوبان المغامرة شيء جميل على قطعة السكر أن تغامر وتتمرد ,1,ثقافة
هل المعرفة نسبية حسب نوع المتلقي ,1,أعتقد أن النقد يعتمد على المتلقي بالدرجة الأولى  فهو يختار أن يستند في نقده لثقافته الخاصة  أو أن يستند للتحليل المنطقي وعدم الانحياز فهذا يعتمد على الناقد نفسه ودرجة وعيه  أعتقد كذلك أن المعرفة أمر نسبي  فأبسط الحقائق اليوم كانت ألغاز بالنسبة لألمع العقول فيما مضى  ,1,ثقافة
كيف تكون مدربا وموجها الكترونيا ناجحا ,0,أرى أنها قريب ا ستحل محل التدريبات الوجاهية قريب أ  فهي تجعل كل شيء أسهل وتيسر العملية التعليمية  وعلى المستوى الشخصي  أنا أفضلها كثير ا عن التدريبات الوجاهية  وأرى أن التكنولوجيا والتحديثات التي تم إضافتها لتطبيقات مثل Zoom أو Microsoft Teams مثل خاصيى الـBreakout Rooms تتيح إقامة العديد من الأنشطة التي تحافظ على انتباه المتدربين وعلى إبقائهم متفاعلين مع التدريب   ,1,ثقافة
مفارقة سليمان  حين نتمكن من حل مشكلات الآخرين ونعجز عن حل مشكلاتنا   ,1,في غالب الأمر إن الأمور تزن من خلال تجربة الانسان وحكمته في قياس الأمور وادراك ابعادها وبالتالي أعتقد أن كبار السن يمتلكون الخبرات نتيجة ما صادفهم في حياتهم العملية وبنيت على ذلك حكمتهم ولكن هل هذا هو الجدار الأخير بالطبع لكل تجربة ظروفها ومسبباتها ونتائجها وقد لا تناسب زمنا أبعد من الزمن الذي وقعت فيه وقد يكون حلول المشكلة في ذاك الوقت اعتمد على عوامل غير متوفرة في هذا الحين وبالتالي علينا أن ندرس المشكلة من ابعادها المختلفة وهنا قد يمتلك صغير السن الناضح فكرا متقدما أكبر مما يمتلك الكبير من تجارب عديدة اوافقك الرأي أن الانسان قد يسأل غيره عن كيفية معالجة صراخ ابنه في وجهه وهل هذا دلالة على فشله في التربية ام لا  هذه حيرة تنتاب كل شخص واللجوء لشخض ثقة ذو معرفة ودراية وحكمة قد يجيبنا او يوجهنا نحو أقصر الطرق ويعيد ترتيب أفكارنا بكل سلاسة ونجاح ودائما عندما نوجه غيرنا بصورة غير مباشرة وفي الوقت المناسب يكون ذلك افضل من تقديم توجيه مباشر في وقت غير مناسب ,1,ثقافة
بعض الأفكار لا تأتي عنوة  لكنها تختار المثابرين بعناية ,1,الأفكار الابداعية  لا تأتي فقك وأنت في الحمام  ربما عند ذهابك إلى فرش النوم  أثناء ركوبك حافلة وأثناء ممارستك للرياضة وربما وأنت تؤدي  صلاتك  قد تستغرب ذلك لكن حقيقة  وللأسف سمعت  أن هناك من تأتيه فكرة مبدعة أثناء الصلاة لماذا تحديد ا  الحمام  لأنه لا يحتوي على مشتتات  حيث الصفاء الذهني والتركيز  فلا شيء يعيق تفكيرك أتذكر أن هناك مساهمة تناولت هذا الموضوع تحديد ا  وكان هناك نقاش قوي عليها من قبل المستخدمينكنت أستغرب حق ا عندما كانت تخبرني أمي بأن خالي يجد أحيان ا أفكار ا وحلول ا حول المشاكل المستعصية,1,ثقافة
العناصر الخمسة لاستراتيجية Five Ps ما بين التدريب وتطوير الشخصية,0,هل هذه الاستراتيجية تتواجب مع كافة الأهداف المختلفة من الحقائب التدريبية فمن المفترض أن استراتيجية التدريب تختلف باختلاف الهدف من الدورة التدريبية نفسها   وأهم المعايير التي تتحكم باختيار الاستراتيجية  هي الأهداف التدريبية  ونوعية المتدربين  والمحتوى النظري للمادة ,0,ثقافة
لماذا نسيء توقع ما يمكن أن يجعلنا سعداء حق ا ,1,بشكل عام أنا من الأشخاص التي لا ترفع من سقف توقعاتها ازاء مسألة ما  فمثل ا عندما ارتأي انجاز مهمة ما  وهل حق ا  ستتكلل المهمة بنجاح أم لا  فتجدني أضع أسوأ السيناريوهات  واتوقع أنني قد لا أنجح في ذلك  مع أنني بذلت جهد ا كبير ا على المهمة وأتخذت بعض المعايير التي تساعد على النجاح إلا أنني لا أتأمل كثير ا  فبالتالي عند نجاح هذه المهمة  أشعر بسعادة غامرة وربما تدوم هذه عادة لدي حق ا وللاسف للكثير من العائلات لدينا  فمثل ا لو عدنا لشهادة الثانوية العامة  مع أنني نحصل على معدلات عالية  تجدنا سعيدين بشكل ملحوظ لكن بمجرد سماع أن من أقل منا في المستوى التعليمي  قد ننصدم  وبالتالي السعادة تنتهي وتدخل في مرحلة انطفاء ,1,ثقافة
وجود الانسان في اماكن لا تشبهه هو ما يصنع الطفرات,1,هنالك من يستطيع التكيف والتأقلم  وهنالك من لا يملك ذلك على رغم مسئولية الشخص في اتخاذ كل  ما يزلم لمحاولة التكي ف مع المحيط أو إيجاد نقطة واصلة تتفق بين ميوله وذلك المجتمع الذي يبدو لوهلة مختلفا  عنه  إلا أن  تلك المسئولية لا تقع على عاتق الشخص وحده  على المحيط أن يكون معاونا  جيدا  ويحاول جذب  م ن يبدو شاذا  عنه  ليندمج معه  هذا الأمر لا يقع في شخصياتنا وتخصصاتنا وحياتنا فقط   بل إنه قد يعني الحياة بأكملها ومدى تقب لها لأولئك المختلفين عن الطبيعيين سواء صحيا  أو نفسيا  أو جسديا  أو حتى عقليا   لذلك أؤكد هي ليست مسئولية الشخص وحده  وإنما المجتمع بأكمله ,1,ثقافة
مفارقة الاختيار  حين تعوقنا كثرة الخيارات عن اتخاذ القرار المناسب ,1,رغم ذلك    السر هنا هو أن تعرف نفسك    كثرة الخيارات ستعيقك في حال لم تكن واثقا من نفسك    كل ما يتطلبه الأمر هو معرفة الذات والثقة بالنفس    وعندها حتى لو كان هناك مليون خيار فما ستحتاجه سيكون واضحا لك  _ ,1,ثقافة
تأثير أكراسيا  لماذا لا نتابع ما شرعنا في القيام به  وماذا نفعل حيال ذلك ,0,ببداية كل عام تقريبا  نضع خطة مثالية لكل ما نود القيام به  وكل ما نريد إنجازه  وتعلمه  والحقيقة أننا نكون على ثقة من أننا سنحقق كل المذكور  لدينا من الطاقة والوقت ما يسمح بذلك  لكن بالواقع ومع نهاية المدة المحددة قد لا نكون أنجزنا نصف ما دوناه  وأحيانا لا نبدأ ببعض الأهداف هذا التأثير قد يعادل كلمة التسويف  أو عدم ضبط النفس  والفلاسفة اليونانيين القدماء مثل سقراط وأرسطو هم من طوروا كلمة لوصف هذا النوع من السلوك  أكراسيا أحد التفسيرات التي  تفسر سيطرة هذا السلوك على حياتنا  يتعلق بمصطلح في الاقتصاد السلوكي يسمى التناقض الزمني  والذي يشير  إلى ميل العقل البشري إلى تقدير المكافآت الفورية بدرجة أعلى من المكافآت المستقبلية فمثلا عندما تضع خطط ا لنفسك  مثل تحديد هدف لفقدان الوزن أو  تعلم لغة   فأنت في الواقع تضع خطط ا لنفسك في المستقبل  أنت تتخيل ما تريد أن تكون عليه حياتك في المستقبل  وعندما تفكر في المستقبل  من السهل على عقلك أن يرى القيمة في اتخاذ الإجراءات ذات الفوائد طويلة الأجل ومع ذلك  عندما يحين وقت اتخاذ القرار  لم تعد تقوم بالاختيار لنفسك في المستقبل  بل أنت في اللحظة الحالية  وقد اكتشف الباحثون أن الذات الحالية تحب حق ا الإشباع الفوري  وليس المكافأة طويلة المدى  هذا هو أحد الأسباب التي تجعلك تنام مثلا وأنت  تشعر بالحافز لإحداث تغيير في حياتك  ولكن عندما تستيقظ تجد نفسك تسقط في روتينك اليومي  باختصار يقدر عقلنا الفوائد طويلة المدى عندما تكون في المستقبل  لكنه يقدر الإشباع الفوري عندما يتعلق الأمر باللحظة الحالية يمكننا التغلب على هذا التأثير من خلال الالتزام إنها طريقة لتقييد السلوك المستقبلي  وربطنا بالعادات الجيدة  وتقييدنا من العادات السيئة هناك طرق عديدة لإنشاء الالتزام   فمثلا يمكنك تقليل الإفراط في تناول الطعام عن طريق شراء الطعام في عبوات فردية وليس بكميات كبيرة  أيضا من خلال وضع أهداف لا تفوق إمكانياتنا  بل تكون ضمن قدراتنا وتتناسب مع الوقت المتوفر لدينا بحيث نتمكن من البدء والاستمرار  فعادة ما يكون التواجد بمنتصف العمل أو المهمة أفضل من الشعور بالذنب نتيجة المماطلة ,0,ثقافة
لماذا كان أجدادنا لا يكفون عن الإنجاب   وجهة نظر بريئة ,1,أود أن أضيف أيض ا أن الأشخاص الذين كان لديهم أراض  زراعية كبرى  كانوا ينجبون الكثير من الأبناء حتى يساعدونهم في الزراعة وبالتالي الربح أكثر  ليس فقط عندما يضعف عودهم ويشيب شعرهم  ولكن حتى في صحتهم وشبابهم أراه شيئ ا محبط ا للوالدين  أتخي ل نفسي مكانهم أحاول مساعدة أبنائي بقدر استطاعتي  ولكن فور أن أشيخ يتركونني  هو شئ يثير السخط رغم ذلك  كثرة مشاغل الحياة أحيان ا قد تجعلنا نغي ر رأينا في هذا الأمر  فلو كان أبناؤه جميعهم مشغولون بعملهم وأطفالهم  فيظل من الصعب عملي ا الاعتناء بالوالد أيض ا طوال الوقت  هنا لا أرى زيادة دور رعاية المسنين شيئ ا سلبي ا  فعلي الأقل ستوفر عناية أكبر لهم ,1,ثقافة
في هذه المناسبة الخاصة    ما أكثر شئ تفتخرين به ,1,في حياتنا جميعا امرأة نفتخر بها دوما مهما كانت مكانتها وهي الأم  أعظم امرأة في حياتنا رجال ونساء  وهي نفسها التي أنا ممتنة لوجودها بحياتي  افتخر بها ودورها التي قدمته وما زالت تقدمه على أكمل وجه  حتى الآن ورغم أنه دورنا نحن لنرد لها حسن عملها لكن مازالت تعاملنا كالأطفال تقلق علينا وتهرع إلى أي منا إن علمت أنه ليس بخير  دعائها يرافقنا دوما  بارك الله لنا جميعا بأمهاتنا وفي عمرهن بالنسبة للاحتفال  رغم أني عرفت بالصدفة صباحا أن اليوم هو يوم المرأة العالمي  لكن ما الذي يقدمه هذا الاحتفال للمرأة  كنت سأكون أكثر سعادة لو أن هناك مميزات يتم منحها لكل امرأة تقوم بدور مؤثر  بحياتها  مثل النساء اللاتي يقمن بدور الرجل والمرأة بحياة أولادهن  النساء المكافحات التي اختفت علامات الأنوثة من على وجوههم من حجم المسئولية الملقاة على عاتقهم  والنساء اللاتي فقدن أولادهن كشهداء للوطن  هناك امرأة مكافحة تجوب الأرض من أكل تأمين حياة أولادها  هذه المرأة تحتاج للدعم من المجتمع   الدعم المادي بالطبع  الفعل دوما أبلغ وأفضل من القول ,1,ثقافة
 إذا قتلت صرصور ا فأنت بطل وإذا قتلت فراشة فأنت مجرم  إن للأخلاق معايير جمالية  ,1,أتفق مع نيتشه إلى حد  ما  لأن مقولته سليمة إذا نظرنا إليها من خلال إعلام اليوم  لأن ه يتخذ الجمال كمعيار في بعض الأحيان  وأحيان أخرى لايمكننا أن نعرف على أي أساس يقرر   ببساطة سلطة الإعلام لا دين لها  ترفع المجرم وهو مضرج بدماء ضحيته  وتلبسه وسام البطولة أما عن قضية أوكرانيا فأنا لم أتابع أخبارها البتة  ليس لأنني لا أتعاطف أو غيره  لكن بعد طول متابعة للسياسة والقضايا الإنسانية أدركت أن رأيي لن يقدم ولن يؤخر  لكنه مهلك بالنسبة لي جدا في واقع اليوم نتوقع كل شيء يا زينة  لا يمكننا أن نركن للأخلاق ولا حتى ننتظر العدل من الإعلام ,1,ثقافة
