Question,Subj_Q,Answer,Subj_A,Domain
ما هو التسويق شامل القنوات Omni Channel Marketing  ,0,عملت  من قبل مع شركة NOON  والتي يتشابه نشاطها مع الكثير من مشروعات التجارة الإلكترونية  بيد أنها تمتلك قاعدة واسعة للغاية من الجماهير  عملت  وقتها على أعمال لها علاقة بالكتابة التقنية التسويقية  والتي تتمث ل في أشكال مختلفة من المحتوى  مثل وغيرهم أدركت  خلال هذه الفترة كم القنوات التسويقية التي تمتلكها هذه الشركة  وبالتالي فإن مسألة التسويق الإلكتروني في ذلك الحين قد تغي ر مفهومها لدي  بدرجة غير مسبوقة  عددتها فترة فارقة في مساري المهني  لأنها كانت المرة الأولى التي أكون قريب ا فيها من استراتيجية تنفيذ لشركة عملاقة بهذا الحجم  وأستطيع الجزم بتطبيقهم للتسويق الشامل بطرق مبتكرة ومتعد دة ,0,التسويق الالكتروني
ما رأيك في العينات المجانية كوسيلة ترويجية ,0,للأمانة حين أسمع بموضوع العينات المجانية  على الرغم أنني لا أتفق كثيرا  مع الأمر  لإن ه  لا يتناسب مع الكثير من المنتجات خاص ة مع المنتجات التي لا يمكن أن ت شترى وتحص ل إل ا لمر ة واحدة فقط ولكن لا يمكنني أن أتجاهل أحلى قصة في هذا الأمر  قص ة بعتبرها أهم من كثير من قصص المشاريع التجارية الأخرى  حين قام صاحب شركة ستناندر أويل  جون روكفلر  بمنح الصين ثمانية مليون مصباح كيروسين بدون مقابل  حيث فرحوا بهذه الهدية واستعملوها  لكن بعدما تعودوا على ضوئها القوي  اضطروا لشراء الكيروسين من روكفلر وجعلوه غنيا  بفضل التسويق بالعينات المجانية على نطاق واسع كبير وهذه التجربة برأيي رائعة من حيث التخطيط وفيها مخاطرة كبيرة جدا   هو يقوم بإنشاء سوق كامل بالعينات المجانية ,1,التسويق الالكتروني
استراتيجية خفض السعر   هل تبتعد عن شراء المنتجات منخفضة السعر ,0,يعتمد الأمر على الدراسة معم قة للجمهور المستهدف  لأن حيلة السعر المنخفض من أجل هامش ربح مرتفع لا تجدي في الكثير من الأحيان  وذلك يعود إلى أن مختلف أصحاب الأعمال والمشروعات من المبتدئين يغفلون ما أدعوه بمؤش ر القيمة لدى شريحة العملاء المستهدفين ولنقر ب معنى مفهوم مؤش ر القيمة  أطرح تجربتي الشخصية في العمل على منصات العمل الحر على سبيل المثال  نظر ا لكوننها شكل ا مصغ ر ا من آلية الطرح والتسعير  يظن المبتدئ في هذا المجال أن خفض سعر الخدمات يكفي للحصول على عروض يقوم بها  لكن ذلك بسبب احترافية بعض المشروعات  يصدمه بحقيقة أن السعر ليس المعيار الأول  وأنه في الكثير من الأحيان يكون دليل ا على المستوى والجودة والاحترافية  لذلك فإن خفضه لا يساعده على ربح المشروعات هذا هو ما يحدث على سبي المثال مع آبل  فعلى الرغم من أن الكثير من الشركات تعمل على خفض التكلفة من أجل عملائهم  تصر آبل على أسعارها  لأنها تعمل من خلال استراتيجية التمايز  التي تهدف إلى إيصال القيمة للعملاء  وتلعب على فئة بعينها  لا تعتني بمسألة السعر وإنما بالقيمة ,0,التسويق الالكتروني
انتقل بأعمالك من مرحلة  يعرفونك  إلى مرحلة  يثقون بك  و ضاعف مبيعاتك ,0,في سياق تجربتي الشخصية  أجد أن الأمر يعتمد على الغرض الحقيقي وراء الحملة الترويجية  هذا هو ما يغفله الكثير من المسو قين  وبالتالي يعمل معظمهم على تحقيق أهداف  لكن هذه الأهداف للأسف تكون غير مفيدة أمام الغرض الذي يجب ان يكون مستهدف ا  فيستهدفون المزيد من المبيعات على سبيل المثال  في حين أنهم في حاجة إلى زيادة الوعي بالعلامة التجارية أكثر من ذلك وعليه  فإنني في مسار العمل الحر وحملتي للتسويق الذاتي في إطاره  أجد أن بناء الثقة هو الأهم  لا الحصول على المزيد من فرص العمل  لأن فرص العمل متوافره بالكم المناسب لخبرتي وقدراتي في الوقت الحالي  لذلك زيادتها ليس بالأمر الذي يجب أن يكون مستهدف ا  وإنما يجب أن أستهدف المزيد من التوعية بمساري المهني وخدماتي كعلامة تجارية منفصلة ,1,التسويق الالكتروني
كيف تتحول الحملة التسويقية إلى حملة فيروسية بفضل الألعاب التسويقية ,0,هذه التقنية فعالة جدا في مجال التسويق  إذ يعمل التسويق على تطويعها لتخدم أهداف تسويقية بحته  مثل الارتباط  إذ تعمل على ربط المستهلك بالمنتج  والعلامة التجارية وخلق علاقة عاطفية بينهمالولاء للعلامة التجاريةالتوعية بالعلامة التجارية حتى لو بشكل بدائي من خلال معرفة الاسم على الأقل استراتيجية التلعيب من الاستراتيجيات الفعالة سواء على مستوى التسويق أو بالعمل  فمثل ا أنا بالعمل انتظر يوم الخميس واتشجع له بسبب وجود مسابقة شطرنج بفريق العمل  كذلك لو اطلعت على مستقل وخمسات ستجدين نظام الشارات التي تحصلين عليها هي نموذج لها ,0,التسويق الالكتروني
كيف نستخدم التسويق بالمحتوى لتحقيق الأهداف التسويقية ,0,التسويق بالمحتوى عبر المدو نات هو ما أحبذ  على الرغم من أنها واحدة من أقدم أنواع التسويق بالمحتوى إلا أن المدونات لا تزال تمثل الغالبية العظمى من المحتوى المستخدم في التسويق بنسبة تتعدى الـ 80  بأخر دراسة  وهذا ما أكدته دراسة أخرى 2020  والتي أكدت أنواع المحتوى الأكثر أهمية للمسوقين والتي جاء في مقدمتها المدونات  يليها النشرات البريدية  ثم محتوى الفيديو  ثم الانفوجرافيكس Info graphics  تكون تلك المنشورات بعدد كلمات معين يبدأ من 1500 كلمة على الأقل حتى تستطيع الظهور بشكل جيد من خلال محركات البحث  تحاول من خلال تلك الكلمات مساعدة الجمهور على حل مشاكل ما بأنفسهم أو تزويدهم بالمعلومات والنصائح والحيل المختلفة  ثم ربطها بما تقدمه من خدمات ومنتجات ومنحهم الأسباب والأساليب التي تشجعهم على استخدام المنتج أو الخدمة التي تروج لها ,0,التسويق الالكتروني
كيف تكون تجربة المستخدم إحدى أعمدة التسويق الرقمي بالنسبة للشركات ,0,التجربة هي أول ما أواجهه عندما أقرر شراء منتج ما  وبنسبة 99  من جهتي لن أكمل عملية الشراء بتات ا إن كان الموقع غير سلسل  بطيء  غير مرتب أو مريح  صعب في التنقل والبحث عليه  وهكذا  أرى أن أي شخص قرر أن يطلق مشروع ما ويؤسس موقع ليس عليه الاقتصاد في تحسين واجهة المستخدم  فهي أحد الأمور التي تجعل العميل مفضل ا للتجربة أو لا  ومن ثم فإن الاقتصاد في هذه الأمور سيعود بالسلب على الموقع والمشروع ,1,التسويق الالكتروني
كيف أقوم بإعداد خطة محتوى ,0,أفعل ذلك بصفة دائمة يا ديما  نظر ا لأنني كاتب محتوى من جهة  ومسو ق إلكتروني ومدير حسابات من جهة أخرى  لذلك فإن خط ة المحتوى بشكل عام تشمل أكبر جزء من عملي علينا أن نعلم أن نجاح الحملة الترويجية بالكامل يتوق ف على مرحلة المحتوى  لأنها تمث ل الجانب التنفيذي الأكثر فاعلية وإقناع ا  من أهم التفاصيل التي يجب مراعاتها خلال هذه المرحلة تتمث ل في الآتي بالنسبة إلي  ,0,التسويق الالكتروني
التسويق بالعمولة وكيف نحقق من خلاله مدخول     موقع خمسات نموذج ا ,0,نقطة هامة للغاية يا مريم في الحديث عنها وتوضيحها خاصة مع نيتي للإنضمام إلي برنامج التسويق بالعمولة المقدم من منصة خمسات  بالأساس فكرة التسويق بالعمولة تستهويني كثيرا  في الفترة الأخيرة  وما تعمل عليه من تحقيق دخل سهل وبدون أي مجهود سوي في مشاركة رابط العمل علي مجموعة المستفيدين سواء علي موقعي الشخصي أم مجموعة أو صفحة مجتمعية أو أي وسيلة أخري ,1,التسويق الالكتروني
ما هي العوامل التي تؤثر فينا كمستهلكين عند اتخاذ قرار شرائي ,0,أنت اخترت هذه الشريحة حسب حاجة وكل منا له دوافعه للأختيار واتخاذ القرار  هناك عوامل تؤثر في قراراتنا وتكون لها الأولوية أكثر من عوامل أخرى وحسب ما نريد اختياره  على سبيل المثال لو انا أريد تناول لحم فأهم العوامل التي تؤثر في اتخاذي القرار هي العوامل الدينية مثل عدم تناول لحم الخنزير ولا بد ان يكون مدبوح وغيرها  وكل شخص له أولوية في العوامل المؤثر عليه في اتخاذ القرار ,1,التسويق الالكتروني
حمى الاستهلاك وآثارها المرضية,1,من الأسباب التي تدعو إلى إدمان التسوق والتخزين هو افتقار الناس إلى الأمان في عصرنا هذا  فبسبب ما يشهده العالم من توترات وصراعات وأوبئة   أصبح الكثيرون يشعرون بحاجة إلى التسوق والتخزين للشعور بأنهم بأمان  مع أنهم يبحثون عن الأمان في المكان والطريقة الخاطئين   في هذا الصدد  ألوم الكثير من صفحات مواقع التواصل الاجتماعي وقنوات يوتيوب التي تضع عناوين مخيفة وتدعوا إلى التخزين لجلب مشاهدات بغض النظر عن تأثير الوضع العالمي  الشخص الذي لا يشعر بالأمان في أي من جوانب حياته المختلفة هو أكثر عرضة لإدمان التسوق أو ظاهرة الاكتناز  أبرز ما يمكن فعله لعلاج هذه الظاهرة هي تعزيز الإيمان ومعرفة أنه لن يكون هناك مهرب من أي مكتوب مهما تسوقنا وخزنا ,0,التسويق الالكتروني
ما هي الآثار الجانية للاعتماد على أسلوب التسويق الشفهي ,0,ليس جميع المنتجات  هناك منتجات تكون جيدة جد ا ومفعولها كبير وأحس ان يجب على الجميع تجربتها مثل مواد العناية بالبشرة فأقترح على أقاربي وأصدقائي تجربتها ولن يندموا  اما المنتجات التي يكون لها صيت كبير ويتم تسويقها بشكل كبير ولا تكون مفيدة أو مثل ما يتم تسويقه او الفعالية أيض ا أشارك رأيي السلبي حتى يحذروا من الانخداع بعمليات التسويق  أعلم أنه قد يختلف الامر من شخص لآخر في بعض المنتجات والحالات  لكن هناك أيض ا يكون سيء بالفعل للجميع ليس بنفس المستوى الذي يتم تروجيه لهم هذا ما اتحدث عنه برأيي التسويق على مواقع التواصل الاجتماعي كما اقترحتي مع وضع تجارب ورأي الزبائن لكي يكون هناك مرجع يعتمد عليه العميل المحتمل طريقة جيدة  الترويج للصفحة نفسها ,0,التسويق الالكتروني
كيف استطيع الوصول لأصحاب المطاعم لترويج منتج رقمي يضاعف مبيعاتهم ,0,لقد تحدثت الزميلة أية في مناقشتها عن أفضل طرق التسويق  وبالإضافة إلى الأساليب المطروحة يمكنني القول بأني أميل في هذه الحالة إلى فكرة التسويق التقليدية إلى حد ما  وخاصة أن أفكار التسويق الأخرى لم تؤتي ثمارها معك حتى الآن وهنا أقدم لك فكرة توظيف بعض المساعدين للوصول إلى أكبر عدد من المطاعم المستهدفة وجمع البيانات حولها وحول كيفية التواصل مع أصحابها  وبعد ذلك تتواصل معهم بصورة مباشرة  قد تأخذ الفكرة وقت ا ولكن لا بأس بالتجربة  وأتذكر كذلك أن هناك ما يسمى بدليل الشركات والمؤسسات  وفيه توجد طرق التواصل مع أصحاب تلك المؤسسات  يمكنك البحث عما إن كان هذا الدليل متوفر أم لا والعمل من خلاله ,1,التسويق الالكتروني
كيف نجحت شركة IHOP للترويج لمنتجها الجديد بدون أي ميزانية ترويجية ,0,من ضمن هذه الاستراتيجيات الفع الة منخفضة التكلفة  تناولت  تجربة شركة  نيكس  من خلال الترويج عن طريق المؤث رين المناسبين وصن اع المحتوى ذي الصلة بمنتجاتهم عبر الإنترنت  حيث أن الأمر  أصبح واحد ا من أهم آليات التسويق  أسعد باطلاعك على هذه المساهمة من هنا سطعت علامة نيكس التجارية في عالم المستحضرات التجميلية خلال الفترة الأخيرة بنجاحات ونتائج غير مسبوقة  وعلىمن خلال هذين المساهمتين  يمكننا أن نستنتج أن فكرة العمل على محتوى إعلاني منخفض التكلفة دائم ا ما ترتبط بالتسويق الإلكتروني المناسب والاحترافي  والذي يساعدنا على الوصول لأكبر عدد من  العملاء المناسبين والمستهدفين بدقة  من خلال أقصر الطرق  هذا هو مربط الفرس بالنسبة إلي  ,0,التسويق الالكتروني
ماذا نتعلم من حملات Apple وخاصة حملة Hollywood in Your Pocket ,0,تحليل رائع وزاوية مميزة كالعادة يا مريم  بالنسبة لهذه الصفة الملازمة دائم ا لشركة Apple بالتحديد  فأنا ما زلت  محتفظ ا برأيي  في هذا السياق  وهو ما أشرتي أنت  إليه بطريقة غير مباشرة في المساهمة المذكورة من قبل  حيث أن مثل هذه الشركات  ذات الأسقف المرتفعة والتكلفة الباهظة للمنتجات  تعتمد على لعبة التفر د الاجتماعي  والتي تشعر العملاء بأنهم فريدون من نوعهم  يعاملون بطريقة مميزة  ولديهم ما يجعلهم مختلفين عن الآخرين  إنها لعبة استراتيجية تسويقية فع الة جد ا تسم ى استراتيجية التمايز ,1,التسويق الالكتروني
البحث المتقدم في تويتر وكيف نستغله في التسويق الإلكتروني لنشاطك التجاري ,0,لا شك أن البحث المتقدم على تويتر مهم جدا فتويتر يضاف إليه كل يوم قرابة 500مليون تغريدة و 145 مليون زائر يومي له فببساطة االسوق هنا ليس محدود بل عالمي  يساعدك على تحديد المنافسين في السوق ويقربك م نالعملاء لمعرفة ردود فعلهم وتوجهاتهم ولكن السؤال هل سيظل البحث المتقدم لتويتر مفيد في حين أن مستعملين التويتر في الشرق الأوسط هم 6 5 مليون فقط وليسوا بشكل دائم لذلك شخصيا أفضل استعمال الفيسبوك أو الانستجرام  مع أنهم لا يمكون تلك الأداة الرائعة  ولكن يمكنك من خلالهم فهم القليل من توجهات الناس وأرائهم ,0,التسويق الالكتروني
كيف تعمل  نظرية Jobs to be Done في التسويق للمنتجات وتساهم في زيادة الأرباح ,0,لا أعتقد أن  هذه النظرية ي مكن تطبيقها على موضوع الم ستقلين وأعمالهم  لإن  معظم الم ستقلين لديهم أعمال شبه متشابهة مؤتمتة لا إجتهاد كبير جدا  فيها  مثل مثلا  كتابة 10 مقالات في مجال الرياضة  ما الذي يستطيع أن يفعله فعلا  المستقل هنا لتطبيق هذه النظرية  أنا أقول لك  لا شيء  هو يجب وكل ما ه نالك أن يكتب بجودة عالية وتفاعلية مثلا   ليضمن أن  عمله له  قيمة سواء تقنيا  مثلا  SEO أو من حيث المعنى والأهمية والإفادة  أو ربما إذا خرج فعلا  من الصندوق سيجد قنوات أخرى لتوزيع أعماله وجهده أو طرق أخرى للتسويق الذاتي ,1,التسويق الالكتروني
ما الذي تعرفه عن التسويق عبر البريد الإلكتروني ,0, تصميم بريد إلكتروني لكل نظام أساسي   فاليوم   يمكن الوصول إلى البريد الإلكتروني عبر مجموعة من الأجهزة   مثل الهواتف والأجهزة اللوحية وأجهزة الكمبيوتر  وما لم يتم تصميم بريدإلكتروني لكل نظام أساسي   فقد يرى عملاؤك نسخة أقل من مثالية من بريدك الإلكتروني ايضا بخصوص التكلفة   فبينما تزعم العديد من خدمات البريد الإلكتروني أنها مجانية   إلا ان الكثير منها يفرض رسوم ا على الإجراءات الإضافية مثل إضافة الصور أو تجاوز عدد الكلمات  وهذا يعني ان نتأكد من معرفة الإرشادات الخاصة برسائل البريد الإلكتروني المجانية أو تفهم الرسوم الإضافية التي قد تتكبدها  وعندما يكون لديك شخص ما يصمم قالب بريد إلكتروني   ساعد في بناء قاعدة بيانات لجهات الاتصال ذات الصلة   وقد يبدأ نشر البريد الإلكتروني في الضغط على الميزانية ,0,التسويق الالكتروني
كيف تكون أبحاث السوق مهمة في اتخاذ القرار بالمنتج المناسب لهذا السوق ,0,اقرأ بمجال التسويق منذ فترة ولم يصادفني به استراتيجية وليس بها دراسة السوق أو أو أبحاث السوق فهذه الخطوة باختصار تعطينا معطيات ومعلومات يمكن من خلالها تحليلها تطوير استراتيجيات وتقديم خطط مستقبلية يعتمد عليها فهي وسيلة قوية في عملية اتخاذ القرار في الشركات وخاصة  بفريق التسويق أول مرة طلب مني دراسة السوق عند دخولي للعمل الحر  كنت بأحد الدورات المختصة وكان بها جزء خاص بالتسويق وطلب منا ذلك  بدأت بخطوات بسيطة مثل منصات العمل  والفئة المستهدفة  ودراسة أسعار الخدمة التي كنت أركز عليها  ودراسة باير بيرسونا أو لنقل شخصية العميل ومعرفة مواصفاته  جمعت معلومات عن أفضل الخدمات المقدمة وسبب تميزها وبسبب ذلك الحمد لله تمكنت من وضع خطة للدخول لهذا المجال وحصلت على العمل من أول عرض على أحد المنصات وبعد محاولات قليلة على مستقل أيضا ,0,التسويق الالكتروني
هل منكم من درس التسويق دراسة منهجية ,0,بطبيعة الحال العشوائية وان حققت شيء ما فهو بالتأكيد مؤقت ولن يكون مرتكز على أرضية صلبة وتأسيس صحيح خاصة أن مجال التسويق الالكتروني وهو عماد المجال هذه الايام متقلب وسريع التغير لمجاراة تقلبات ورغبات الزبون  فصانع المحتوى ربما يستفيد من دراسة عشوائية للتسويق لفترة ما ولتقديم نوعية معينة من الخدمات إلا أنها لن تطول أو لنقل أنه لن يتطور فدراسة التسويق كعلم هو رافد مهم للتسيوق كتطبيق   فالدراسة الممنهجة للتسويق ستنمي قدراتك في النواحي التي تتطلب مهارة عالية ومعارف باستراتيجيات دخول السوق والتسعير وتحليل المنافسين والعديد من النظريات العملية بالخصوص لا أفضل من الالتحاق ببرنامج دبلوم متخصص في التسويق العام وان كنت تريد مزيد من التخصص فالتحق بدبلوم تسويق الكتروني وطبعا قلت الدبلوم لانه أكثر عملية وتطبيقات وتجارب وعليك بالكليات والعاهد التطبيقية لا الأكاديمية ذات الحشو النظري ,1,التسويق الالكتروني
كيف يساهم التسجيل في google my business في التسويق المحلي ,0,ربما لو فكرت لإنشاء موقع إلكتروني وتضع به خاصية الاستشارة الطبية وتغذيته ببعض المواد مثل الأمراض والأدوية ومن ثم تنشره على حساب google my businessسيكون ذلك أفضل بكثير ومن ثم ربط حساب الفيسبوك بالموقع  ولكن إن بقيت على حساب الفيسبوك فلا أعتقد أن ذلك سيفيدها بشيء ,0,التسويق الالكتروني
كيف نختار منصة التواصل الاجتماعي المناسبة لعملنا ,0,أهم نقطة يجب أن تأخذها بعين الاعتبار هي دراسة توجه جمهورك لأنه لا يمكن أن نعطي قاعدة عامة صالحة لكل الشركات والمشاريع   على سبيل المثال إذا كان جمهورك المستهدف من الجزائر فمنصة تويتر غير منتشرة في الجزائر لأن الشعب الجزائري يميل أكثر لمنصات مثل فايسبوك و أنستغرام أما إذا كان جمهورك من مصر فستجد أن توجهاتهم تختلف عن توجهات الجزائريين   بمختصر الكلام يجب أن تفهم جمهورك وتأخذ قراراتك حسب توجهاتهم  ,0,التسويق الالكتروني
