Question,Subj_Q,Answer,Subj_A,Domain
ما هو تعريفك للتحر ش      هل كل المضايقات ضد الانثى تعتبر تحر شا   ,1,بشكل عام   ما هو تعريفك الشخصي للتحرش   صدف منذ مدة أن قرأت تعريف  جريمة التحرش  وفق النيابة العامة بالمملكة العربية السعودية  وأعجبني لذلك أتخذه حاليا  تعريفا  شخصيا  لي نظرا  لدقته رابط   أخي المواطن أخي المقيم  جريمة التحرش تقترف بكل قول أوفعل أو إشارة تصدر من شخص تجاه آخر ذات مدلول جنسي تمس جسده أو عرضه أو تخدش   وهل من حق المتحر ش   او غير اللائق اخلاقيا    ان ينال فرصة أخرى   كما عب ر صلاح   ليستمر في آداء مهامه في وظيفته او عملهنعم من حقه تماما  مثله مثل أي جريمة مماثلة  مع العلم أن هذا الحق  أي حق الفرصة الأخرى يتناقص مع تكرار المتحرش لأفعاله ,1,ثقافة
هل أصابت بلدكم موجة الحر المرتفعة جدا   وكيف تتعاملون معها  ,0,أنا أقطن في أسخن منطقة في العالم D   50درجة فوق الصفر على الظلال    نستغل آخر نسمات البرود في الصباح الباكر بكل شغف حتى نودعها من القلب  ثم نشوي طعامنا ولحمنا  لسنا نباتيين لأن الشمس لم تترك لنا شيئا أخضر  على سياراتنا الملتهبة مع الظهيرة   ليأتي الليل أين نراقب غضب الطبيعة الأشد والأقسى حيث يمتزج الظلام الدامس مع الجو الحار والكثير والكثير من الحشرات المزعجة والزواحف السامة    هكذا نتعامل مع يومنا الجميل في صيف  واد سوف  الجزائرية وفيات يومية خصوصا في شهر جويلية المنطقة بالفعل هي الأكثر حرارة في العالم,1,ثقافة
احببت ان اشارك معكم جزء من تلخيص لكتاب    كيف تكتسب الاصدقاء وتؤثر في الناس     اسم الجزء   جذب الناس إلى طريقة تفكيرك وتكوين الصداقات معهم  ,1,تصرف بطبيعتك افضل من تغير شخصيتك باتباع هذه النصائح  هناك من سيحبون شخصيتك وهناك من سيكرهوها ,1,ثقافة
احببت ان اشارك معكم اليوم  تلخيص كتاب كيف تبيع أي شئ لأي إنسان ,1,أحببت جدا  مقالتك  من فضلك هل لديك كتب أو مصادر أخرى شبيهة بمضمون هذا الكتاب تستحق القراءة ,1,ثقافة
كيف أميز الأشرار حتى لا أقع في براثنهم و كيف أميز الطريق الصواب من الخطأ ,1,شكرا للموضوع   ولكن بالرغم من كثرة التفاصيل ومحاولتك لشرح أدق جزئيات الموضوع إلا أنني لم أستطع فهمه بشكل كامل  ربما لأن النظام لديكم يختلف عنا أو أن نوع تلك القصص لم أسمع به من قبل  الامر الوحيد الذي فهمته جيدا هو استشهاد بالفليم  فانا أعلم أنا الأفلام العربية دائما ما تبني فكرتها على شيء افتراضي  يعني مشكلة قانونية دون الرجوع لطالب في الحقوق حتى ,1,ثقافة
كيف احسن قلمي,1,القراءة المكثفةالكتابة اليوميةهناك تدريبات على الكتابة في الرواية و القصة يمكنك الدخول فيها كتابة أول قصة أو رواية و تجربة نشرها التدريب على قواعذ اللغة من صرف و نحو و غيره عم ار الشقيري يكتب مستعين ا بماركيز وكونديرا وغيرهم قائمة بأهم النصائح التي تقد م لمن برغبون بكتابة رواية  لماذا كتبت إيميلي ديكنسون 1775 قصيدة ولم تنشر منها في حياتها سوى 7 قصائد فقط منسوبة لمجهول  لماذا استمرت في الكتابة بكل هذا القدر من الإبداع   هذا كورس من حول كيفية كتابة روايةLearn the fundamentals of story structure from our MFA program faculty and complete a detailed  scene by scene outline of your novel idea و هذا من يودمي كذلك,1,ثقافة
ما الفرق بين الهندسة و العلم ,0,الهندسة تهتم بالجانب التطبيقي للعلم و كيف يمكن تحقيق اقصى استفادة منه    والعلم يهتم باكتشاف الحقائق بغض النظر عن فائدتها التطبيقية  مثال باحث في مجال الكهرباء و الالكترونيات سيكون اكثر فهما لهذا المجال من غيره لكن لا يمكن الجزم بأنه يستطيع اصلاح الاجهزة الكهربائية  ,1,ثقافة
تربية الأولاد    ام   غسيل مخ   للأولاد  ,1,هل لاحظتم بأن الكثير من المخلوقات تعتني بصغارها لفترة ثم تقوم بتركهم ليعيشوا باستقلالية تامة  فقط الأساسيات   طبعا الأمر مع الإنسان سيكون أعقد تبعا لتعقيد الإنسان ولكن الفكرة هي نفسها this is how life works  إذ لم تترك الطفل يلعب في الطين والاوساخ والشمس فستصبح مناعته ضعيفة  وكذلك الأمر في طريقة التفكير الشخصية والتعامل مع الحياة عموما   استذكر هنا مقولة تنسب لعلي ابن طالب او سقراط او غيره  وهي ان لاتربوا الأبناء بنفس تربيتكم لأنهم خلقوا لزمان اخر    و المقولة ليست بالحديثة   وبالنسبة لاحدى التعليقات هنا التي تقول بما معناه   بما ان الأساليب والأفكار والطرق اثبتت نجاحها سابقا    فيتم توريثها لأنها ستنجح مستقبلا    هذا الكلام صحيح في إطار محدود وغالبا هي معرفة عملية   مثل وصفات الطعام او بعض ال life hacks والطرق والخبرات التي كانت تتناقلها القبائل قديما في الغابات   كمية كبيرة من البول شيت الفكري  تأتي بالتوارث مجانا     عموما وحتى وان لم يكن للمرء قابلية على تبني فكرة الاستقلالية او الإبتعاد عن هذا ما وجدنا عليه آبائنا اقل الأمر أن تتركه وشأنه ان عبر عن رأي مختلف او تبنى نظرة أخرى للامور ,1,ثقافة
كيف أسبح في فلك الممنوع  حول فتح المواضيع المسكوت عنها,1,عزيزي رياض  النقاش في كل المجالات هو سبب تقدم التكنولوجيا والعلم أصل ا  في يوم من الايام كان العلم جزء ا من الكنيسة واذا حاول احدهم السؤال عن امور ان تبد له تسوءه يقتل  ورغم ذلك سؤال العلماء عن كل شيئ واي شيئ وعدم تركهم شيئ ا دون دراسة ونقاش هو الذي أدى لتطور العلم أول ا والتكنولوجيا كذلك  العلم بني على اللاضوابط الا المنهج العلمي  لا حياء في العلم  وضع حدود وضوابط لما يمكن السؤال عنه سيقتل العلم والتكنولوجيا  ولا تنسى ان العلم بني على الفلسفة التي بنيت على السؤال عن كل شيئ واي شيئ  ولو قام جالليليو او نيوتن او سقراط بما تقوله هذا لكنا ما زلنا نعتقد ان الارض مركز الكون ملاحظة  بالنسبة للآية والحديث فأتمنى ان تقرا اسباب النزول او حتى تفسيرات المفسرين  فهي تتكلم عن الأسئلة في الدين وكثرة الأسئلة في الدين  غير ذلك فالله نفسه أمرنا بأن نسير في الأرض وننظر كيف بدأ الخلق  أما ترك أي امر للواقع المعاش شبه مستحيل الا في عالم الحيوان  اما في عالم الإنسان فكل شي ي ناقش ولكنك وانا لسنا مطلعين على كل شيئ  لذا قد لا نرى تلك النقاشات  ولكن أترى  نحن نتناقش في موضوع عن النقاش  الأمر ممتع حق ا ,1,ثقافة
ماذا بحق الجحيم يحدث هنا ,1,الصراحة  أن السبب   في حالتك أنت   هو أسلوبك  كيف تصف شخص ما بالغبي والاخر بأنه لا يفرق بين هذا وذلكأوصفت شخص ا بالغباء  أتمنى فقط أنك لا تعتبرين وصفي للكلمات والأفكار بأنها غبية وصف لأصحابها  فهذه معضلة تحتاج لزيارة الطبيب  البعض اصدقائي  فان وصفتهم وحزنوا كانوا ليخبروني ولكن أعتقد أنه من حقي أن أخبره انه يخلط بين المادية والعلمانية  ولا يوجد أدنى عيب في ذلك ويمكنك سؤاله بنفسك  وبالتالي كلامك بعد هذا عن الوصف غير لائق لا معنى له ما علينا كما يقال لكن أن تناقش موضوعا  ما   واضعا  في حسبانك  بأن لديك معرفة جيدة فيه في حين أن الباقي مجرد طلاب إعدادية فلن تجد أشخاص كثر يرغبون بالنقاش معك حتى لو أمنوا بأنك على صواب وإذا كنت تعتقد بأن الناس ترغب فعلا  بمعرفة الحقيقة فأنت لا تعرف الناس جيدا  يا   عزيزي  أنت تتعامين وتتحاملين علي يا  عزيزتي    أناقش ربى وأناقش إيفان والآراء تتصادم  وما العيب في أن أعتقد أن لدي معرفة جيدة بموضوع ما  هل ذهبت وقلت لأحدهم انت لا تفقه شيئ ا في هذا الموضوع  كل من يتناقش يجب أن يؤمن بالموقف الذي يناقشه حتى يبذل قصارى جهده أتتوقع أن الناس سيقرؤون الموضوع ثم سيفكروا هذا ما يفعله العقلاء يا  عزيزتي   كما اني لم آتي بأفكار تخالف التقاليد والعادات  بل جئت مدافع ا عن هذه التقاليد بعد هذا الاقتباس الكثير من التنظير والهراء أوه  أنت صاحبة موضوع الهراء الفيسبوكي  وداع ا,1,ثقافة
لما يكره الناس أصواتهم المسجلة عند سماعها,1,نعم يختلف عما كنت اتصوره  ولكن لما هناك فئة من الناس صوتهم جميل في المسجل اكثر من الواقع وبدون تعديل ,1,ثقافة
ماهي نصيحتك لطلبة الباكالوريا  الثانوية العامة أو التوجيهي ,0,بما أن الإمتحانات قد انطلقت بالفعل فالنصائح الضرورية في هذا الظرف هي  النوم لساعات كافية فمن لم تكفيه السنة بطولها للمراجعة لن تكفيه بضع ساعات وقلة النوم تعني قلة التركيز وتأثيره سلبي بدون شك على الطالب عدم النقاش حول الأجوبة بعد الإمتحانات لأن هذا قد يؤثر على معنويات الطالب وتهتز ثقته بنفسه لو اكتشف أن أجوبته خاطئة في مادة من المواد خلال أيام الإمتحان يمكن للطالب فقط القاء نظرة سريعة على المواد التي تعتمد على الحفظ أما المواد التي تحتاج فهم فليس وقت مراجعتها أيام الأمتحانيجب على أفراد أسرة الطالب أن يحاولوا قدر المستطاع توفير الظروف الملائمة للطالب حتى يكون تركيزه على الإمتحان  من هدوء وعدم إشغاله بأمور أخرى      أنا حاصل على الباكالوريا مرتين ,1,ثقافة
تعدد أم تفرد المهام   أيهما أنجع في الحياة ,1,فما هو الأسلوب الذي يستحق أن يتخذ منهجا في الحياة الشخصية بالنسبة إليك بالنسبة لي تعدد المهام يصلح جدا  في الحياة الواقعية  على سبيل المثال لنقل أن لديك عم يسكن قرب سوق ما وهو يبعد عنك 30 دقيقة فأقوم بما يلي  أمضي إليه أزوره ثم أذهب للسوق أشتري الحاجيات التي حضرت قائمتها من قبل وأعود فيكون  مارست المشي صلة الرحم التسوق  في نفس الوقت أو في وقت متقارب جدا لأنه لاحظ أن التسوق يتضمن المشي بل قد تصطحب عمك أو ابنه معك فيحصل المقصود  في هذه الحالة بالذات أنا لا أركب السيارات ولا الحافلات لأنها تضي ع المقصود من المهمة أصلا  أما في العمل ولا سيما أعمال الإنترنت والأعمال الرقمية فلا يصلح هذا  على الأقل بالنسبة لي  لأن الجودة تتطلب التركيز  والتركيز لا بد له من مهمة واحدة في فترة زمنية معينة  الطريقة التي أتبعها بسيطة وهي كما يلي  رقم 1  لا بد من تحديد سقف أعلى للإنتاجية في اليوم  بمعنى تحدد لنفسك كمية واضحة لا تتجاوزها حتى لو كنت تريد المزيد وقادر على ذلك  والسبب في وضع هذا السقف للحفاظ على الاستمرارية فلما  تمضي ميلا  آخر  كما يقول الإنجليز قد تنتج جيدا في ذلك اليوم لكن ستضعف استمراريتك وكما هو معروف في هذا العالم الدنيوي  الاستمرارية مع إنتاجية قليلة تغلب الإنتاجية الكبيرة مع التقطع   وهذا هو بالضبط مغزى قصة السلحفاة التي غلبت الأرنب رقم 2  خذ استراحات من المهمة الواحدة التي تنجزها في فترة زمنية محددة  في تلك الاستراحة قم بالأمور المستعجلة والهامة التي تأتيك  على سبيل المثال أنت تعمل في مهمة أ تستغرق منك 4 ساعات من عميل ما  وفي غضون تلك الساعات أتتك مهمة مستعجلة ب من نفس العميل لا تستغرق منك أكثر من 15 دقيقة  لما تعمل بنظام العمل 45 دقيقة وأخذ استراحة 15 دقيقة ستجد دوما وقتا  للمهام المستعجلة  يبقى هنا أن نشير إلى أن هذه الطريقة تقتضي أنك قمت ببديهات مسبقة منها  إن تفحص قائمة مهامك بسؤال  لماذا  مهم جدا لأنه لو فرضنا مثلا أنك تعمل في شركة ذات بيئة إنتاجية عالية وغير إنسانية  راجع الضجة التي أجريت حول شركة سويڤل لمعرفة الأمر ابحث في الشبكات الاجتماعية بهاشتاق    swvl  وتنام في كيس نوم في مقر الشركة لأن ذلك كما يقول أحد مدرائها  ثمن  أن تصبح عظيما   لو كنت  موظفا لديهم بذلك النظام لكانت لدي قائمة مهام لكن فيها سطر واحد مفاده  الاستقالة من هذه الشركة الموبؤة  أرجو أن تكون هذه النقطة وضحت لأنها مهمة للغاية لما تعد ل قائمتك بما يتماشى مع أهدافك بعيدة وقصيرة ومتوسطة المدى لن تطول أما إن لم يكن لديك خطة  أي أهداف بعيدة وقصيرة ومتوسطة المدى فهذه مشكلة جوهرية يجب حلها في أقرب فرصة  خلال الأسبوعين الماضيين  قمت بمراقبة كل 15 دقيقة من يومي بعد معرفة أين يذهب الوقت كل ما عليك فعله هو إعادة توزيعه وتوجهيه لإنجاز المهام المطلوبة التي كما أسلفنا لها سقف محدود يوميا لأن هدفنا الاستمرارية لا الإنجازات المتقطعة لو تعامل الوقت كأصل من الأصول بمعنى اقتصادي استثماري ستجد دائما طرقا جديدة لإنجاز المهام  أخيرا نصيحة قيمة من هارفارد بزنس ريفيو حول الموضوع  ,1,ثقافة
قبل وبعد 20 سنة من التطور   ماذا ينتظرنا بعد 20 سنة من الأن يا ترى ,0,المشكلة في الصورة أننا الآن وصلنا إلى 1000 GB وأكثر في usb   أما 128 و 200 فتجدها في بطاقات الذاكرة الخارجية للهواتف,0,ثقافة
كيف ندعم المشاريع العربية الناشئة ,0,أتفق معك  لكن أهم شيء بالنسبة للمشاريع العربية الناشئة هو المال لذلك أرى بوجوب التبرع مثلما يفعل الغربيون فحين يقرأ مقالا و يستفيد منه أو يدخل موقعا و يستفيد منه في عمله يتبرع له ,1,ثقافة
هل نقرأ عن الفلاسفة أولا     ام نبدأ بقراءة كتبهم  ,1,الأفضل أن تبدأ بالكتب الشارحة والسبب أن مصطلحاتهم لها معاني محددة وفق نسقهم الفلسفي  كل فيلسوف على حدا   مع ذلك لا ينطبق هذا على جميع الفلاسفة فهناك من هو واضح مثل فلاسفة الرواقية مثلا  نصائح على السريع الحوار تبين أنه وسيط رائع لتبسيط الفلسفة لذلك تعد محاورات أفلاطون بأجزائها المختلفة بداية ممتازة  هناك عدد كبير من الفلاسفة وضعوا نتاجهم بشكل محاورات منهم جورج بركلي وغيره لا أذكرهم جميعا الآن القصص أيضا ممتازة لتبسيط الفلسفة لذلك تعد الكتب القصصية مدخلا رائعا لفهم فلسفة الفلاسفة الذين كتبوها على سبيل المثال قصة سلامان وابسال لابن سينا وحي بن يقظان لابن طفيل ومنطق الطير لفريد الدين العطار أمثلة ممتازة كتب التراجم  السير الذاتية  الخاصة بالفلسفة وأنصح هنا بكتب عبد الرحمن بدوي في المجالمعاجم مصطلحات الفلسفة  كثيرة ومتفاوتة الجودةمجلة الاستغراب  لها أعداد  متخصصة في فيلسوف معين وتبسيطها غير مخل ومفيد جدا مثلا لديهم عدد عن هيغل وآخر عن دريدا وآخر عن هايدغر وجميعهم يوجعون الرأس لو تقرأهم مباشرة هذا الكتاب أفادني جدا  رحلات داخل الفلسفة الغربية جورج زيناتي رابط مفيد تنويه  المصادر تنفع كثيرا إن كنت من جيل الألفية أو تعرف أحدا من جيل الألفية يحب هذه المواضيع والتعمق فيها  مدخل جديد الى الفلسفة     اكتب فلسفة في مدونتي ستجد جملة من المقالات حول الموضوع بها مصادر مفيدة للغاية ,1,ثقافة
سافر تجد عوضا  عم  ن تفارقه ما رأيك في السفر وماهي فوائده في زمن الأنترنت ,0,يعتبر السفر والاغتراب من أقوى المعلمين فهذه الحياة   ستتعلم أشياء وتقابل أشخاص لم تكن لتتعلمها  في بلدك ولكن السؤال هل هو مفيد دائما   الجواب هو لا فهناك الكثير ممن يفسدهم السفر ويعلمهم أشياء تجعلهم أكثر سوئا  شهدت تحول الكثير من الاصدقاء حولي كنت اعرفم طيبين الى أنانيين أو انتهازيين بغير رحمة أظن الأمر يعتمد على الإنسان نفسه كما يعتمد على سبب السفر بحد ذاته,1,ثقافة
هل يجب ان تكون هناك إمرأة حتى يصبح الرجل عظيما ,1,لا  والأمر سي ان بالنسبة للمرأة ,1,ثقافة
هل الدين مصدر الأخلاق  ,0,تلك ليست وضعية بل فطرية أخلاق الفلاسفة وضعية  مثل تكريمهم الرق   السؤال هنا برهن أن أخلاق الفلاسفة يجب الأخذ بها,1,ثقافة
هل يجب أن يكون الانتقام أو العقوبات الجسدي ة جزءا  من نظام العدالة في المجتمع  قصة الفتاة الهولندي ة الم نتحرة مؤخرا  مثالا  ,1,عليك تحري المعلومات  الخبر خاطىء هي ارادت القتل الرحيم و لكن الدكتور لم يوافق و لكنها اضربت عن الطعام و ماتت بسبب هذالان الخبر بالهولندية حدث سوء فهم و سمع الناس انها طلبت القتل الرحيم و انها ماتت و ظن الناس انها ماتت بهذا السبب و انتشر الخبرالمصدر   Noa Pothoven is believed to have refused to eat and there is no evidence of assisted death,1,ثقافة
