Question,Subj_Q,Answer,Subj_A,Domain
مالذي يشغل بال الشباب هذه الأيام ,0,مواقع السوشيال ميديا أخذت منا أكثر مما تعطينا  اي أنها أخذت منا طاقة ووقتا  أيضا    ربما أيضا  أحد الاسباب هي وجود أشخاص من حوله يقللوا من قيمة الشيء الذي يفعله او يحبطونه كأن يقولوا له لن تصل الى مرادك او سيكون صعبا  عليك هذا الطريق الاهتمام الذي يعطيه الواحد منا للناس وكلامهم يجعل جل  تركيزنا يقع في كيف نرضي الناس أو أن نظهر أمامهم بأحسن صورة  فيضيع الوقت في كيف نظهر ناجحين أمامهم وليس كيف ننجح    خاصة اذا كانوا من نفس العمر  ربما هناك بعض المخاوف لديه   فبدلا  من أن يفكر كيف ينجز في مشروعه   يفكر في الهرب من هذه المخاوف   لذلك أول نصيحة هنا ممكن أن تنصحها هي   واجه مخاوفك   ,1,ثقافة
هل تتسرع بالزواج أم تتريث لإختيار الشريك المناسب ,0,للوهلة الأولى   يبدو أن الأرقام تدعم الزواج   مما يشير إلى أن المتزوجين في المتوسط   أسعد من غير المتزوجين وأكثر سعادة من المطلقين  لكن التحليل الدقيق يكشف أنه إذا قمت بتقسيم  المتزوجين  إلى مجموعتين على أساس جودة الزواج   فإن  الأشخاص في الزيجات الفقيرة التي يتم تقييمها ذاتي ا يكونون بائسين إلى حد ما   وأقل سعادة بكثير من غير المتزوجين   والأشخاص في الزيجات الجيدة ذاتية التقييم هم أكثر سعادة    وعندما نختار شريك الحياة  فنحن نختار الكثير من الأشياء   بما في ذلك شريكك الأبوي وشخص له تأثير عميق على أطفالك   وعلى اعتبار أن الحياة الزوجية ستستمر بإذن الله 30 عام مثلا فأنت تختار رفيقك في تناول الطعام لحوالي 33000 وجبة   ورفيقك في السفر لحوالي 100 إجازة   وشريك وقت فراغك الأساسي وصديق متقاعد   ومعالجك المهني   وشخص ستستمع لما حصل في يومه حوالي 11000 مرة إنه قرار خطير ولابد من التريث قبل إتخاذه ,0,ثقافة
هل نستطيع أن نحكم على شيء يخصنا بموضوعية تامة ,1,أنت محقة للغاية   هذه هي الطبيعة البشرية التي رغم محاولاتنا بتغييرها إلا أننا ننجرف عن الحيادية   نحكم على الجميع بمنتهى الموضوعية   إلا أنفسنا أو أقربائنا   بل حتى الغرباء   ففي بعض الأحيان   نضع صورة نمطية عن أحد ما لا نعرفه   فقط لأننا أحببنا شكله أو ابتسامته    ولو كانت الموضوعية صفة فينا لما كانت المحسوبية والزبونية في المعاملات الحياة   تخيلي أن شرطيا سيقبض على أخيه ويجز به السجن فقط لأنه سرق   أولا ستتحكم به العواطق والدم الذي يجمعهما   ولنفترض جدلا أنه فعل وسجن شقيقه سيبدو الأمر غير عقلاني   وسيصفه الجميع أنه متحجر المشاعر وبلا قلب   بل ومريض نفسي   أليس كذلك  ,1,ثقافة
ما الفرق بين اللايف كوتشينج والتنمية البشرية ,0,أريد ان استوضح كيف تحديد ا تعتبر التنمية البشرية هراء ,1,ثقافة
كيف نحمي أنفسنا من الوقوع تحت سطوة التفكير المفرط ,1,بالقراءة والفهم  حتى اتباع تمارين معينة لضبط النفس بالفعل تؤدي نتائجها  هذا الأمر بالنسبة لي لكن بشكل عام لو أردت بداية الرد سأقول بالفهم فقط  الفهم لما تمر به والاعتراف به هو الفصل الأهم من هذه القصة  التفكير المفرط   الفرق بين الأمرين ندى أن الأول أتي من تجربة شخصية والقراءة والتمارين والعادات الهادئة يمكن أن تكون غير مناسبة للبعض  بينما الشيء الأساس لنا ككل هو الفهم  إن فهمت المرحلة أنت تحاول هزمها حتى ولو لم تفهم أسبابها فهم الأسباب يأتي بالضرورة من فهمك أنك بحالة  تفكير مفرط  لأنه سيأتي بكذا طريقة  قد تقول لأصدقاءك المقربين لأفراد عائلتك ومن هناك يتم التفاعل معك من أجل الخروج بحل أو لنقل حلول ومن ثم يتم ترابط فهمك مع الأسباب فتصل نوعا  ما إلى حل الحل أمر نسبي يأخذك  من نقطة لأ خرى ومن تفضيل لآخر  في مثال بما أنني أحب القراءة وجدت  نفسي هناك بنوعية كتب جديدة تعمل فكري وليست كتب مسيرة  فأصبحت المساحة للتفكير المفرط ضيقة جدا  وتم دمجها بالأفكار الموجودة بالكتب كذلك التمارين لا أعلم تماما  ما اسمها القياسي لكنها تمارين عقلية يركز فيها عقلك على تكرار تمارين يتفاعل معها جسدك ونفسيتك مثل التنفس بطريق معينة  مد  يدك  للخلف دقائق ومجانبتها دقائق  كذلك عدم مشاهدة أو التطرق لأي شيء يرتبط ولو ارتباط بسيط بالأمر الذي ت فرطين به التفكير  النوم بهدوء ومحاول اشغال العقل والجسد بتوازن دون أن تكون لأحد السلطة على الآخر أحب  لو اسمع رأيك في الأمر أيضا   ليس رأيك  العام  بل المرتبط بهذا السؤال من منظورك الشخصي إن لم يكن يتعرض لشيء  خاص    ليبقى السؤال  كيف لنا أن نعزز جهودنا نحو دوائر تأثيرنا المباشرة  ونحمي أنفسنا من الوقوع أسرى للتفكير المفرط  ,1,ثقافة
هل تحكم على الشخص من الموسيقى التي يستمع لها ولماذا ,1,ما رأيكم هل يعكس نوع الموسيقى ثقافة الشخص الذي يستمع لها وهل ستتجنب التعمق في علاقتك مع شخص لا تعجبك ذائقته الموسيقية  هي لا تعكس الثقافة بقدر ما تعكس النضج الذي يعيشه الانسان   وقد ترتبط ايضا بحالة الانسان النفسية   وهي لا تستمر طوال الحياة حتى تعكس خلفية الانسان   ماذا عن شخص يفضل الاستماع لكل انواع الموسيقى الجديدة والقديمة الغربيةوالعربية   كيف يمكن ان تعكس الموسيقى ثقافته   لكن حينما تقرر ان تسمع موسيقى هادئة   فيعني ان مزاجك الان في حالة هدوء   اما ان كنت تفضل سماع موسيقى مليئة بالضجيج  والراب   فيعني انك تملك الكثير من الطاقة الان التي تود ان تفرغها بسماع هذه الكلمات  اما عن الجزء الاخر من السؤال  فأنا لا يمكن ان اقطع علاقتي بإنسان فقط لان ذوقه الموسيقى رديء بالنسبة لي  ,1,ثقافة
هل شهادة في كلية المعلمين ملزمة للتعليم في مدرسة ,0,هل برايك كلية المعلمين مفيدة للمجتمع ام يمكن الاستغناء عنها الإجابة عن سؤالك هنا ستختلف كليا عن الإجابة عما قبله  لأنك ه نا عممت السؤال عن كون الكلية نفسها هامة من عدمه  وعن فائدتها بصورة عامة بالنسبة للمجتمع  حتى أنك تتساءل عن الاستغناء عن كلية المعلمين  من اسم الكلية فهي المادة الخام لإعداد معلمين قادرين على توفير عملية تعليمية جيدة لنا ولأبنائنا في المستقبل  كيف لنا أن ننادي بتطوير التعليم من ناحية ونتساءل إذا ما كانت كلية المعلمين مفيدة للمجتمع أم لا من الناحية الأخرى  لا أجد أن نتيجة لتحقيق متخصصين بالرياضيات مثلا نجاحا في مهنة التدريس  أن تكون ترجمته أن نلغي الكلية الأم المسئولة عن إعداد مدرسين رياضيات مختصين أيضا  التدريس قبل أي شيء يحتاج لمهارات عديدة  وإن كنت طالبا بكلية المعلمين ولا تمتلك لهذه المهارات ولا تحاول أو تسعى لاكتسابها والتطوير من شخصك فلن تكون معلما ناجحا في كل الأحوال  وهذه ترجمتي لكون هناك أشخاص ليسوا بخريجين كلية التربية لكنهم حققوا نجاحات فيما يتعلق بهذا المجال الخلاصة  لا يمكننا أن نهدم الصرح الأم المسئول عن إعداد المختصين الأساسين في أي مجال أيا ما كان مهما كان السبب لأن هذا سيؤدي إلى قصورا آجلا أو عاجلا في المنظومة بأكملها  غير أن أغلب الوظائف بل كلها إن جاز القول تعتمد على المهارات واكتساب المعرفة وتطوير المرء لذاته  لذلك إن اعتمدنا على ذلك كمعيار أساسي سنستيقظ يوما لنجد أنه قد تم الاستغناء عن جميع الكليات وليس كلية التربية فقط ,1,ثقافة
في الثقافة المالية متى تتوقف عن دفع الديون ,0,لماذا لا تقسم الامر  أي تضع خطه او جدول لما عليك ولما لك  مثلا أحدهم له عندك 1000 دولار وانت تملك في حسابك فقط 1000 دولار اما ان تعطي له دينه كاملا وتصبح خالي الوفاض  او ان تقسم هذا المبلغ  فتعطيه مثلا 500 دولا وتستثمر الباقي في عملك ما أقصده ان تحدد ما بمقدورك دفعه للديون كل شهر مثلا  ولا تحيد عنه وأيضا تسعي للتطوير وأكتساب الاموال بما يتبقي لك  حتي تستطيع الموازنه في حياتك  ,1,ثقافة
ما رأيك في الزواج بين الجنسيات العربية ,0,الزواج في الأول وبالآخر يعتمد على الوفاق بين الطرفين والقبول والرفض بصرف النظر على الجنسية لا أرى مشكلة بذلك وطبعا  البركة في قوانين الأحوال الشخصية اللي مخوفة الشباب من المصريات لم افهم هذه النقطة هل وضحتها ولماذا بنت البلد أصبحت متروكة  ولماذا تقبل الفتاة العربية عربيا بشروط ميسرة وترفض إبن بلدها و تثقل عليه لا أجد أن هذا سبب أساسيا في زيادة نسبة العنوسة  فمقابل الشباب الذين اختاروا فتيات من بلدان عربية أخرى هناك مصريات تزوجن من رجال عرب وأجانب أيضا  لذا لا أجده سببا مباشرا لذلك بقدر ما للظروف الإقتصادية من تأثير  وأيضا ارتفاع تكاليف الزواج والمعيشة ايضا الفتيات المصريات ينظرن للرجال الأجانب أنهم سيقدرونهم أكثر مما يفعل الرجل المصري وهو اعتقاد سائد قد تلامسه في وسائل التواصل  فالفتيات يرين أن الشباب المصريين ليسوا عاطفيين ولا يقدروا المرأة كما يفعل الرجال الأجانب  ومن هذا المنطلق أصبح زواج الفتاة المصرية من رجل عربي هو حلم للكثير من هذه الفتيات وعلى الصعيد الأخر ترى فتيات عرب يمدحون كثيرا بالرجال المصريين وكيف يعاملونهم وووو أما عن قبول الفتاة بشروط أقل  اراه غير صحيحا  فالشروط بمصر من الأساس تثقل كثيرا على الفتاة تحديدا  في أغلب الدول العربية تجهيز منزل الزوجية على الزوج كليا وهذا عكس ما يحدث في مصر مثلا  فهناك من يتشارك مناصفة في كل يء  وهناك تقاليد أخرى أكثر تعقيدا وهذا كله مخالف للشرع ,1,ثقافة
كيف يكون إنطباعك الأول حول الأخرين    تأثير الهالة Halo Effect,0,بصراحة انا من خبراتي وتجربتي في الحياه ان لا احكم على الشخص من مظهر وعن تجربة لان المظاهر خداعة ليس كل شخص جميل من الخارج هو جميل من الداخل الحكم على الاشخاص يأتي من تصرافاتهم وافعالهم الحسنة وليس المظهر فكم من سخص جميل الخ لق لم يكن جميل الخ لق ,1,ثقافة
لماذا يقل شغفنا في تكوين الأصدقاء كلما كبرنا ,1,لماذا يقل شغفنا تجاه تكوين الصداقات وما التغيير الذي يطرأ علينا ويجعلنا لا نريد تكوين أصدقاء جدد السبب يعود  بالدرجة الأولى لزيادة المسؤوليات في الكبر وانشغالنا أكثر بالحياة وحلول المشاكل    أما في الصغر عكس ذلك تماما لا نملك الكثير ونلجأ للإستمتاع وتكوين الصداقات  غالبا كلما كبرنا في السن كلما قل حيز الصداقات   فالبعض ينشغل والآخر يبتعد  ,1,ثقافة
هل سبق وتخليت عن قرارك فقط لأنك لا تتفق مع ميول الجماعة ,0,فالبعض يعتمد على رأي الجماعة في أمور ليست محوية  وبعض أمور أخرى يعتمد عليها بسبب جهل العلم بالشيء ولا يريد بذل وقت وجهد في دراسته لأن هذا الأمر سيتطلب معرفة وعلم لتحديد القرار  ولكن مع الأخذ في الاعتبار نسبة لكون الاختيار غير صائب وبالفعل كما ذكرت تتخذ الشركات العاملة في مجال التداول على سبيل المثال هذه الأمر في حشد الناس التي ليس لها دراية في سوق التداول بهذه الطريقة للتربح من خلالهم ,0,ثقافة
لماذا الصراحة والكلام المباشر مفقود لدينا ,1,لا اعرف هل ابالغ ام ان ذلك مستشري حقا  وما سببه هي ليست مبالغه البته  هذا حقيقي جدا  أعتقد سبب هذا هو اننا جميعا  تقريبا  تتحكم بنا العاطقه حتي في العلاقات الرسمية  لذلك يشعر المرء بأن رفضه مثلا لطلب ما حتي اذا كان لغريب يمر في الشارع دون سابق معرفه  او حتي طلب شئ ما من شخص أقول انه يشعر حينها بتداخل في المشاعر تقريبا   فقبل ان يرفض يشعر بانه سيصبح ندل حتي لو كان هذا غير حقيقي بالمره  او عندما يطلب من احد شئ في بداية الاتصال يشعر بأنه أناني وغير  ودود وهكذا لا اعلم حقا  هل هذه الرؤية صحيحة ام لا ولكن هذا ما يحدث معي برغم انني مثلك تماما  لا احب التملق ولا المجاملات ,1,ثقافة
هل طبع المزيد من العملة يؤدي بالضرورة لحدوث تضخم ,0,ليس شرطا أن زيادة طبع العملة يسبب تضخم  ففي حالة زيادة المال والنقود مع الناس ستزداد معدلاتهم الشرائية وسيزداد الطلب وتزداد القوة الشرائية الاستهلاكية وبناء  عليها يزداد إنتاج الشركات ويزداد معدل النمو الاقتصادي لكن المشكلة قد تحدث  إن عجزت الشركات عن سد الحاجة الشرائية ولجأت للاستيراد وبالتالي يتأثر الاحتياط النقدي من العملات الأجنبية  وتبدأ المشكلة من هنا ,0,ثقافة
نقاش  هل يقلل الكشف الصحي والنفسي قبل الزواج من معدلات الطلاق ,0,برأيي ان الطلاق بتزايد لسبب اخر و هو إستقلالية المرأة ماديا و ثقافيا  فلا تحتاج الى ان تبقى بزواج فاشل لأنها لا تحتاج الى الزوج للعيش  فإن لديها عملها و مالها  و كذلك الى حد ما اعتماد الرجل على نفسه في إعانة نفسه  فالكثير من الشباب يهتمون بنفسهم لا يحتاجون الى احد يطبخ لهم او يغسل الملابس إذا كنت تظن ان الطلاق شيء سيء و يحتاج الى العلاج  فإن الحل هو حل المشكلة التي تسبب الطلاق بالاساس و هو الثقافة بحد ذاتها عند الزواج التقليدي  زواج الصالونات  يالرجل يأتي و يريد خدامة و طباخة و جارية تحت يده  يتصرف امامها كعنتر و المرأة تريد أن تخرج من بيت ابيها لتعيش احلامها في الغناء و البذخ لذلك تبحث عن محفظة و  ATMعندما تتغير هذه النظرة و الثقافة الى ثقافة وئام و تشارك و صراحة أسأل اي زوجين زواجهم ناجح ما سرهم  سيقولون لك التفاهم و التنازل احدهم وضع مثال الزواج يكون حقيقي عندما تضع 60  من الجهد به و توقع ان الاخر يضع 40  و عندما الاثنين يريدون ان يكون 60  ,1,ثقافة
هل سبق لك أن وقفت موقف المتفرج أثناء حدوث موقف طاريء في مكان عام  تأثير المتفرج أو Bystander Effect,0,جعلني مقالك افكر لو انني مكان الضحية   كيف اكسر تأثير المتفرج او فكرة هي عند طلب المساعدة من الجمهور اطلبها من شخص محدد     اختر اي شخص ووجه كلامك له بالتحديد    هذا سوف يعزله عن تأثير الجمهور ويعطي احتمال اكبر للاستجابة     وربما يحفز شخص اخر    ولكنني حصلت على تدريب متقدم كمسعف   والخطوة الاولى هي الطلب من احد الجمهور بالاتصال بالاسعاف  ,1,ثقافة
هل نحن حقا  نعرف الشخصية الحقيقية للأشخاص من حولنا أم يبقى هناك جانب خفي دائما  ,1,مسألة وجود الجانب الخفي هي مسألة واقعية لا ي مكن إنكارها  فمهما كانت نسبة القرابة بين الطرفين يظل هناك جانب لا ي مكن الإطلاع عليه ر بما يتم اكتشاف جزء منه أحيان ا وربما لا  ولكن مسألة تقبل هذا الجانب الخفي تتوقف على نوعه  فهناك جوانب خفيه تقع تحت الخداع أيض ا  وهو أن يخفي الشخص أمر يؤثر بشكل جوهري على علاقته بالشخص الأخر  كأن ي خفي الشخص أمر شخصي هام عن شريك حياته ربما يؤثر على قراره في مشاركته الحياة  وهل تعتقد أن هذا حق من حقوقنا جميع ا أم أنه يجعل علاقتنا بالغير وعلاقة الغير بنا ناقصة كذلك مسألة أنه حق أم لا  تتوقف على الشيء الذي تم اخفاؤه  وهل هو جانب شخصي أم يتعلق بأشخاص أخرين وقد يؤثر على حياتهم بشكل يوجب معرفتهم به  ولكن كيف ي مكن التعامل عند اكتشاف جانب خفي في شخص م قرب لك  قد يؤثر على نظرتنا له وعلاقتنا به ,1,ثقافة
هل التظاهر يجعلنا أشخاص أفضل في أعين غيرنا ,1,أرى أن هناك فرقا ما بين التجم ل والتظاهر    ففي أحيان كثيرة نلجأ إلى التجم ل وإلى الظهور بصورة أفضل مما نحن عليه  ليس غش ا لكن بعض من الجمل المنم قة لا تضر  بعضا من المدح والثناء ثم ذكر العيوب بدلا من النقد الصريح المباشر لا يضر  معاملة الناس بأحسن طريقة تجدها لا تضر    في رأيى أن هذا هو منظور التجم ل ومفهومه لدي    لكن على الناحية الأخرى من ذلك هو التظاهر  التظاهر بصفات عكس ما أنا عليه تماما  ضد مبادئي الأصلية وضد شخصيتي الحالية  أتخلى عن كل ذلك لأرسم شخصا آخر تماما أتعامل به    هنا أجدها مشكلة  ففي إيذاء لنفسي حيث تختفي شخصيتي الحقيقية مع الوقت وأصبح كما قلت  شخصا مزيفا وتضيع هوي تي تماما    وعلى الجانب الآخر سيتأذي كل من يتعامل معي  ففي البداية أبدو جميلا وبشخصية معي نة أتظاهر بها  لكن مع مرور الوقت وعندما يقترب مني أكثر ستبدأ شخصيتي الحقيقية في الظهور وسيشعر حينها بالخداع وسيرى ردود أفعال لم يكن يتوق عها وسيعتبرها تجربة سيئة في حياته   ,1,ثقافة
كيف تعرف نفسك  ,0,اذا انت سعيد بهالمجال لا تخبر أحد    مجرد أن تخبرهم ستفقد السعادة بغموض عملك تحياتي,0,ثقافة
كيف ترى التعاطف المفرط الذي يمنحه الناس للشخص الحزين ,1,أعتقد أيضا  أن  التعاطف الزائد والذي يكون في بعض الأحيان زائفا  قد يترك انطباعا  لدى الطرف الآخر بأن  التعاطف نابع من شفقة الشخص به وليس فقط لأن ه يتعاطف معه  وبرأيي التعاطف الزائد قد يأتي بنتائج عكسي ة كما قلت   فإم ا نفور الفرد من المتعاطف معه أو إخفاء انزعاجه بهذا الخصوص وهو أيضا  يخلق حالة من العلاقات غير الصحي ة كما أعتقد أن  هناك بعض الناس لا يريدون تلق ي التعاطف من الآخرين  ويريدون فقط أن تتعامل معهم كما تتعامل مع أي شخص آخر  هل تعتقدين أن  جميع الأشخاص يطلبون التعاطف والاهتمام بقدر متساو  أم هناك حالات متفاوتة ومختلفة ,1,ثقافة
كيف لك ان تتأقلم     ,1,ولماذا الانتظار  بأمكان المرء دوما القيام بعمل ما  اذا لم يكن لديك مايكفي من الطاقه لإنجاز مهام بأمكانها تطويرك  فيمكنك الجلوس علي نفس الاريكه ومشاهده فيلم جديد او متابعه مسلسل يأخذك الي تفاصيل وعوالم اخري  او بأمكانك قراءة الكتب الخفيفه المسليه حتي اذا كنت غير قادر علي التعلم في الوقت الحالي فأن هذه الاعمال علي الاقل ستجعل الوقت يمر اسرع مما تتخيل وهذا عن تجربه حقيقه  لا تترك الافكار تهزمك فأنت من تصنعها بعقلك  وكل مانمر به من صعاب هو ضرورة حتميه لتقويه عضلات نفسيه بداخلنا العمر اقصر بكثير مما نتصور  دعني اعيد السؤال مره اخري  لماذا الانتظار أذن ,1,ثقافة
هل تعرضت من قبل لظاهرة تأثير المدخل   أو  doorway effect  ,0,هل تعرضت من قبل لهذه الظاهرة   وهل كنت تعتقد بأن ما يحدث معك هو أمر طبيعي ويحدث مع الكل  انني أتعرض كثير ا لهذه الظاهرة  حتى انني بدأت أظن انها احد اعراض الزهايمر او صورة من صوره  ولكني بمجرد التركيز اتذكر ما جئت لأجله في دقائق  ولكن اود ان اعرف ما هي الاسباب خلف هذه الظاهرة  هل هناك خلل او مشكلة تحدث بالعقل تسبب هذه الظاهره ,1,ثقافة
