Question,Subj_Q,Answer,Subj_A,Domain
أي هما ترضى  الحياة مع العبودية أم الحري ة مع خطر فقدان الحياة ,1,هذا الكلام يخرج فقط من الأشخاص الذين يعتقدون أن  الحياة بطبيعتها وبانسجامها اليومي فيها جزء من العبودية  شيء يشعر به الإنسان العادي ويرضاه  نسمع كثيرا  عن عبودية العمل وعبودية الصداقة والعلاقات  عبودية شهوة الطعام والمال  عبوديات كثيرة ولكن أسأل الأن  هل فعلا  جر ب الإنسان الحديث العبودية فعلا   ه نا مثلا   يعتقد القارئ أن ه  يقرأ عن تنافس حقيقي بين الحياة والموت  بين الحرية والعبودية  ولكن أسأل  ما الذي كان يدور في عقول هؤلاء الأفارقة لحظتها  أنا أؤك د لك أن هم لم يكونوا في تفكير نهائيا  حول الموضوعات التي تطرحها حضرتك  لم يكن ميزان ما يقي مون به الأمور الموت والحياة والعبودية والحرية  بل ما هو أشد  إرعابا  وأشد  طلبا  بألف مر ة بالنسبة لهم  وهو الخوف والألم  إن هم يعرفون مخاوفهم على السفينة  لماذا يستبدلونها بالمجهول من المخاوف وبالأقسى منها  إن هم يعرفون الآلام على السفينة فلماذا يستبدلونها بالمزيد من الآلام المجهولة التي قد تكون مبر حة  هذا يزيح المعادلة طبعا   لتصبح ليس موضوعتها بالمر ة الكرامة أو الروح البشرية  بل مقدار ما تتحمل من الضغط النفسي والجسدي  وبهذا صد قني نحدد الموت بحري ة أو العيش بذل وعبودية  عبر انتخابنا الحر في أي  الطرفين أقل ألما  وخوفا  ,1,ثقافة
سبب مشاكل افريقيا هو الاستعمار ,1,يا صديقي أثر الاستعمار لن يزول لأن الاستعمار نفسه باقي عندما اجتمع الظلم والاستعباد والاضطهاد على الدول الافريقية وكلله الاستعمار بنهب للثروات ذلك ليس أمر هين للنجاة منه ببساطة  لأن الاستعمار لا ينهب ثروة فقط بل ما هو أسوا  ينهب وعي الدول الافريقية لا يمكن أن تكون الملامة لأنها لم تستطع النجاة لأنها بالفعل لم تعد كما كانت قبل كل تلك الكوارث  الأجيال التي نشأت في الاستعمار وفي ظل اضطهاد ونهب ليس من السهل عليها السيطرة على كل تلك الأفكار والنهوض بشكل سوي  لأنهم بالفعل فقدوا أكثر بكثير من قدرتهم على التماسك  افريقيا وصلت لمرحلة كانت فيها فقط ليبيريا هي الدولة الوحيدة المستقلة والباقي تحت الاستعمار المختلف دول تونس والجزائر مازالت لم تشفى بالكامل حتى الان  فكيف بمن ذاق أضعاف المعاناة ولا يزال ,1,ثقافة
ما بين الوفاء للعادات والتقاليد والوفاء للحبيبة المخطوبة  أيهما تؤيد ولماذا ,1,لا يمكن أن تدخل التقاليد أو الأمور التراثية في شيء إل ا وتحو ل الحياة إلى أمور جامدة صعبة لا معنى لا لجمودها ولا لصعوبتها  غالبا  ما يحكم في مسألة التقاليد كلام الناس وأقاويلهم وتوقعاتهم اليومي ة عنك  يجب أن تعيش كما يتوق عون أن تعيش  ويجب أن تفعل ما ي فعل دائما   ويعطونك جوائز كثيرة على تمث لك لهذه الأمور  فمثلا  لديك وسام الشرف والقو ة إذا قمت بالزواج لحماية بنت مثلا  من العوز المادي حتى ولو لم تكن لا تملك البائة النفسية والأخلاقية والقلبية للقيام بذلك  يعطونك رمز الشجاعة ورمز الرجولة في الكثير من التقاليد الأخرى  وسام الامتثال والانصياع والذكاء عند قولك نعم لكل ما يجب أن ي فك ر فيه  يخترعون عادة  دساتير للامتثال بها بدون تفكير  هذا ما ي دم ر مجتمعاتنا بأكملها  غياب حرية الفرد في اختياراته وتشب ثه بتراث أباء وأجداد لم ولن يغنوه من جوع أو يأم نوه من خوف  سيحمونه فقط من كلام الناس  الكلام الذي أنتج جورج وسوف عنه جملة أحب ها في أغنيته الشهيرة  كلام الناس لا بيقد م ولا يأخ ر  ,1,ثقافة
هل تعتقد أن النكد له علاقة بالمرأة فقط أم يوجد رجال نكديون أيضا ,1,بالنسبة لي ليست المرأة وحدها المسؤولة عن النكد  لكنها فقط تهمة الصقت بها من طرف مجتمع ينظر إلى المرأة نظرة دونية مختلفة عن نظرته للرجل  فالنكد أيضا يرتبط بالرجل  الذي يحاول أحيانا خلق نوعا من التوتر داخل بيته نتيجة مشاكل قد تكون  نفسية واجتماعية وحتى اقتصادية  فيضطر لتعنيف المرأة نفسيا بالكلام الجارح حتى يثير غضبها  فتضطر للرد عليه  فينعثها بالنكدية  النكد عند كل الأجناس والأعمار والفئات الإجتماعية  وفي كل زمان ومكان  لأنه لصيق بواقعنا الإجتماعي  السؤال المطروح لماذا تهمة النكد دائما لصيقة بالمرأة ,1,ثقافة
تحليل الشخصية عبر بصمات الإصبع  تحليل الشخصية عبر خط اليد   هل تؤمن بهذا ,0,أراها تحليلات منطقية جدا  فالظاهر له أساس في الباطن  كما ينعكس الباطن على الظاهر  وظاهر الجسم مرآة تنعكس عليها مكنونات النفس  وبدراسة أحوال الناس الظاهرة  يمكنك معرفة أخلاق الناس  وطبائعهم  وتحليل شخصياتهم  ومعرفة ماضيهم وحاضرهم  وحالتهم الصحية قرأت في بعض الدراسات العلمية أن 55  من انطباعات الناس عن الفرد ت ؤخذ من حركاته ووضعه  و 39  منها تؤخذ من نبرة صوته  بينما 1  فقط من كلامه  معنى هذا الكلام أن 83  من الانطباعات المأخوذة عنا كأفراد لا تأتي من كلامنا  ولكن من حركاتنا وإيماءاتنا   أي  لغة الجسد  وهي لغة ليست كسائر اللغات لا تعرف الكذب  لكنها مرآة صافية تعكس مباشرة المشاعر  والأسرار ,1,ثقافة
لماذا ي نصح بالخروج من القرى والعيش في المدن ,0,على الرغم من أن الكثير من الأشخاص يعترض على وجهة نظري هذه  فأنا ما زلت  مصر  ا على أن  الإنسان المعاصر مهي أ لحياة المدينة أكثر من جاهزي ته لحياة الريف  حيث أن التطو ر التكنولوجي يحكم بأحكامه في هذه النقطة تحديد ا  وهو ما يفرض على الجميع أن يتعامل مع الأمر بالأسلوب الذي يتناسب مع شكل الحياة  على هذا الأساس  لا أجد أن إمكاني ة العيش في القري ة ستكون بالتكلفة النفسي ة نفسها  وإنما ستكب دنا عناء الخروج من عباءة التطو ر التقني الخاص بالمدينة  والتي شئنا أم أبينا  لا يمكنها أن توازي القرية مهما انتشرت فيها التقني ات  هذا بالإضافة طبع ا إلى البيئة المحدودة على صعيد العلاقات  وهو الأمر الذي يتنافى بدوره مع طبيعة الإنسان المعاصر أيض ا ,1,ثقافة
ماذا لو كان الوقت سلعة ت باع وت شترى ,0,أعتقد أن الوضع هو نفسه لن يتغيرالوقت سيكون بديل للمال  سيتقاتل الناس عليه كما يتقاتلون على الأموال في الوقت الحالي والفئة الرأسمالية ستسعى للسيطرة عليه بمفردها كما كان الوضع في الفيلم وكما هو الوضع في حياتنا الآن الفارق الوحيد ربما أن الانسان يمكنه العيش بدون أموال  لفترة  ولكنها ليست حياة يمكن احتمالها أما في حالة الوقت فلن يستطيع العيش لحظة فور انتهاءه وكان ذلك سيجعل من العالم فوضى لفئة واحدة بعينها حرية الاستفاده من هذه الفوضى ,1,ثقافة
لماذا ينبغي عليك أن ترسم  حتى وإن لم تكن ليوناردو دافنشي ,0,أعتقد أن الأمر مرتبط بالتصور والتعبير يا محمد والرسم ما هو الا طريقة للتعبير  فلو استبدلنا الرسم بالكتابة مثل ا فالكاتب ينظر للعالم ويرسم من خلال كلماته لوحات تعبر عما رآه أعتقد أن التعبير بأشكاله مهم سواء كان رسم أو كتابة أو حتى تصوير تختلف طرق التعبير ولكن أهميتها واحدة ويمكن اعتبارهم رسم ولكن بفرشاة مختلفة,1,ثقافة
الوصايا الخمس لما تشوف اهل معاهم طفل من ذوى القدرات الخاصه    ,0,أتوقع أهم نقطة الشعور بالشفقة مؤذي حتى أكتر من ألم الاصابة باي شيءوالتعامل من النوع ده بيكون مضر حتى بالطفل ,1,ثقافة
فن قول  لا  كيف تحافظ على موقفك وترفض الإذعان لمطالب الآخرين  ,0,قبل مراحل أكثر نضوج ا  كنت  واثق ا في خياراتي على صعيد العلاقات  ولم أمتلك القدرة على تمييز الصداقات التي تدم ر قدراتنا على التطو ر من الصداقات التي تساعدنا على تحسين نماذج شخصي اتنا  من هنا  استطعت  بعدها أن أضع نفسي في المكان المناسب لإطلاق الأحكام  من هنا  أردت  استخدام المزيد من التقني ات لتنقي ة هذه الصداقات التي تلزمنا بالتعامل وفق أسلوب معي ن من أجل الحفاظ عليها  حتى وإن كان هذا الأسلوب سبب ا في خروجنا عن مسار الالتزام بجدولنا الخاص  اكتشفت  وقتها أن الصداقات المؤذية والسام ة تمث ل إحدى أبرز المشكلات التي قد تواجه الإنسان  وتمنعه من ثقافة الرفض ,1,ثقافة
الاهتمام والشغف هل هما ثابتان ام متغيران ,1,أتذكر  حبي الشديد لكرة القدم  عندما كنت صغيرا بعمر خامسة وتحول ذلك الشغف لـ   البينج بونج  في المرحلة الإبتدائية والإعدادية ومن ثم ولعي الشديد بالتصميم والفن ومؤخرا بتعلم الجيتار     الشغف بطبيعته يتغير مع الإنسان فبمرور الوقت تنضج شخصيتنا لنجد أننا نريد شيئ ا آخر في هذه المرحلة ولكنني اكتشفت في النهاية أنه أمر طبيعي أنا لا أمقت الأشياء الآخرى ولكنني غير شغوف بها هذه الفترة  لذلك دائم ا الكثير من الكتب التي تتحدث عن البحث عن الشغف المتأثرة بالذات  في الحقيقة أنا أرى أنا يجب أن تستمتع برحلة اكتشاف الذات وألا نندم أبد ا لتعلمنا شئ ما لفترة من الزمن لأنه من الممكن أن نعود إليها مرة آخرى    لذلك كل ما يجب علينا هو التركيز لإكتشاف شغفنا الحقيقي ,1,ثقافة
قد تكون مصاب ا بما يسمى  وهم الشفافية  دون أن تعلم ,1,هناك عدة طرق لتجنب الوقوع في وهم الشفافية  ومنهاأن نتحلى بالوعي والتفكير المنطقي عند التعامل مع الأشخاص الآخرين  وعدم الانسياق وراء الأفكار السائدة بسهولة إذ يمكننا البدء بتحليل الموقف وتقييم الأدلة المتاحة قبل الوصول إلى أي استنتاج  مع التحقق من الحقائق والمعلومات المتاحة بشكل مستقل  وعدم الاعتماد على مصادر واحدة فقط  يمكن استخدام مصادر مختلفة مثل الإنترنت والكتب والدراسات للتحقق من المعلومات  يمكننا أيضا تجنب الوقوع في وهم الشفافية عن طريق الحوار الصريح مع الأشخاص الذين تتعامل معهم  يمكنك طرح الأسئلة بوضوح والتحدث بصراحة عن المخاوف والتحفظات التي تشعر بها  وألا نعتمد على الانطباعات الأولية عن الأشخاص  قد يكون هناك أسباب وراء السلوك الذي يبدو غريبا   ولكن يمكن تفسيرها بشكل أفضل بعد التحليل والتحقق من المعلومات ,0,ثقافة
فن الشارع والجرافيتي  تجميل أم تخريب ,1,فن الشارع قد يكون جماليا إن كان مقننا بقواعد منا احترام الخصوصية واحترام ممتلكات الآخرين  فلا يكون كل جدار مباح  ولا كل مبنى متاح للرسم عليه  خاصة عندما يتم رسمه بدون إذن أو تصريح من أصحاب الممتلكات  قد يكون صعبا  إزالة بعض الأعمال الجرافيتية عن الجدران  مما يسبب تلف ا للمباني وتكلفة إصلاحات  كما يمكن أن يكون الجرافيتي غير منظم وي ظهر رسومات غير لائقة أو يتم توزيعه بشكل مؤذي للعين وهذا رأيته على جدران المدارس والجامعات  كل جدار رسمة مختلفة فأجد أن عيني غير مرتاحة وحتى الآن لم أرى تجربة محيطة في فن الشارع تجعلني أن أقول أننا أصبحنا على وعي بالمعايير التي تخرج هذا الفن كصورة جمالية وليس تخريبية ,1,ثقافة
متى يصبح الشغف مرضا كيف نعرف الشغوف بشكل مرضي ,1,عندما لا يكون هناك بديل و لوحظ على الإنسان الطغيان بالشيء كالهوس الذي يمنعه من الراحة و النوم و التفكير الطبيعي و يدخله إلى ما لا حد له يتحول الشغف إلى مرض لأنه تطور من حالته الطبيعة إلى حالة غير طبيعية تسمى الإدمان على الشيء دون الانقطاع عنه للراحة و البحث عما يكمل هذه العادة و الهواية و الموهبة ,1,ثقافة
هل القدرة على القراءة والاستيعاب تختلف في رمضان عنها في الأيام العادية ,1,على الرغم من أن العديد من الأشخاص يعانون من هذه الظاهرة في الليالي الرمضانية  فأنا أجد ان الأجواء في رمضان تكون مناسبة جد  ا للقراءة  سواء كان الشخص صائم ا أم لا  سواء كانت الفترة قبل الإفطار أو بعده  فالعديد من الظروف تصبح متاحة بشكل مجتمع في رمضان أكثر من أي مرة قبله  حيث وغيرهم من الظروف التي تتيح لنا القراءة من جميع الجهات ,1,ثقافة
كيف تتخطى فترات الحزن ,0,أهل ا علا يسعدنا مشاركتك لنا تجربتك بتخطى  الأمور  لا أعلم ما أقول ولكني أشعر أن الحزن أصبح رفاهية  في الوقت الحالي  ليس لدي مساحة لأعيش حزني بسبب ضغوط الحياة  أشعر أن الأمور يجب أن تمضي تمضي على أية حال زلكن لو كان معي خيار لتخلص من حزني سأتبع التالي,1,ثقافة
الأحلام لا تحمل أي معنى  ما رأيك ,1,بمناسبة عدم منطقية الأحلام  لقد ذكرتني بأحلام العصاري  لا أنام مرة في هذا الوقت إلا وأحلم بأحداث لا علاقة لها ببعضها  السمك يطير في السماء  وأنا أخوض امتحان ا صعب في مطبخ بيتنا  لا أؤمن بالأحلام صراحة وأجد الحديث عنها مثله مثل الحديث عن الأبراج وما إلى ذلك من الأمور  أكتفي باعتبارها عملية يقوم فيها المخ بمعالجة الأحداث اليومية أو التي حدثت من فترة قريبة  أؤمن أيض ا بأن الأحلام تتعلق بالأفكار التي يخزنها الشخص في عقله الباطن ولكنه لا يعترف بها أمام نفسه فيكون الحلم بمثابة كشف لحقيقة تأثره بالفكرة  لم يحدث أن تحقق معي حلم لأن أحلامي جميعها غير منطقية تقريب ا هل حدث أن تحقق معك  أنت حلم في الواقع يا خلود ,1,ثقافة
التسول ظاهرة اجتماعية يمارسها الاطفال في رمضان,1,عن نفسي  أحارب التسو ل بشكل  فردي   قدر الإمكان من خلال عدم التعامل مع أي شخص يعتمد على هذه المهنة  لا أرغب على الإطلاق في الخوض في النوايا  لكن في المقابل  لا يمكننا أبد ا أن نمنع المساعدة عم ن يستحق ها  وبوقوفنا بجوار التسو ل كنوع من أنواع المساعدة  فإننا بذلك نقف بجوار من لا يستحق عوض ا عم ن يستحق  إن الأعمال المهني ة البسيطة يقع عليها ظلم كبير  لأن دخل صاحبها يعتمد عليها فقط  وبالتالي فهو في حاجة أكبر إلى المساعدة عوض ا عن محترفي التسو ل  هذه الفئة تحصل للأسف على مستوى دخل خرافي مقارنة  بعملها  ناهيك عن ثقافة الاستسهال التي تعتمد عليها  والتي تنتزع بها حق المساعدة مم ن يضع جهده بالكامل في عمل يحفظ له كرامته الإنساني ة ولا يحصل حتى على نصف المقابل ,1,ثقافة
تغيير المسميات   هل يعمينا عن حقيقة الأمور ,1,ليس ذلك فقط  بل إن  كلمة   تنمر  أصبحت تضم طيفا  من الدلالات و المعاني  فأيما أنسان يتنكر لي أو يستهزأ بي أو يشتم أو يضرب أو يكش ر أو   أو إلخ    أو أي من الأفعال السلبية التي تعبر عن تعاملات الناس مع بعضهم البعض أصبحت تنضوي تحت كلمة   يتنمر أو متنمر أو تنمر   الحقيقة هذا تقزيم لمعاني و دلالات الشعور ودلالات الكلمات التي تضم طيفا  واسعا من المعاني عندنا في لغتنا الثرية جدا   وكلمة   تنمر  موجودة في معاجم اللغة العربية وهي تعني   التلبس بصفات النمر  ومعروف عن النمر أنه حيوان شرس غدار ليس له إباء وكرامة الأسد مثلا  ولذلك عندما ننعت بها أي إنسان فإننا نشبهه بالنمر من حيث الخسة و النذالة و التصرف المزري السيئ  هذا هو المعنى الأصيل الذي أرفضه وأستهجنه أن  تضم تلك الكلمة هذا الطيف الواسع من المعاني  فإذا شتم طالب زميله في المدرسة نقول تنمر وإذا نظر إليه نظرة ازدراء نقول تنمر وإذا ضربه نقول تنمر وكأن لغتنا عقمت فليس فيها إلا تلك الكلمة  الحقيقة فيما يبدو لي أننا رحنا نترجم تلك الكلمة الإنجليزية   Bullying  بالتنمر  فلما شاعت عندهم رحنا نبحث عن مقابل لها في لغتنا فشاعت تلك الكلمة على الألسنة وهي كلمة تستخدم في مواقف خاطئة  ذات مرة أم تلميذ في الصف الرابع تقول أن تلميذا  آخرا    تنم ر  على ابنها   ضحكت من الكلمة ومن استخدامها في ذلك الموقف وقلت  هم أطفال لا يعرفون التنمر    فقط أطفال أشقياء   لا داعي لتلك المصطلحات العجيبة  الغريب أني حينما بحثت عن أصل كلمة   Bully مشتقة من الألمانية القديمة boele   وجدت أنها كانت تعني في البداية تودد و تحبب إلى شخص آخر  كانت تعني   lover or sweetheart  هذا في البداية في اللغة الإنجليزية القديمة ثم تصحفت فصارت زميل أو صاحب طيب ثم انقلبت اليوم إلى الضد وتصبح بمعنى جبان خسيس يعامل الآخرين معاملة غير لائقة  هناك من الناس من يعتبر اللغة كائن حي يتطور ولا يصح أن نعترض على ذلك وهناك منهم من يعد ذلك خروج على الأصل و تصحيف وتخريب  إلى أي  رأي تميلين رغدة و لماذا ,1,ثقافة
ما الذي يتحكم في طريقة نظرتنا لأجسادنا ,0,الاجابة تكمن في الشخص كل شخص يملك تلك العلاقة بين الروح و الجسد   فمهما تنبأت بإجابات لسؤالك فلن تجد إجابة مقنعة وثابتة   فإذا كان يرى الشخص X نفسه قبيح الأنه تعرض لتنمرات خلقت له عقدة تجاه جسده   فالشخص Y يرى نفسه قبيح الانه لا يخضع الا معايير جمالية محددة لمجتمع ما   و اذا كان Z يرى نفسه جميل لأن المعاملة الأسرية خلقت له نوع من الثقة فيه نفسه فإن W يظن أن لا مقارع له في جماله لأن صديقته جمالته في هذا        فكلا و علاقته مع جسده  اما بالنسبة لسؤالكما موقفك ممن يعتقدون أن مناطق من الجسد هي وسيلة للفخر مثل عضلات الرجال الرياضيين مثلا فلهذا السؤال جواب تاريخي و اجتماعي في آن واحد فمنذ عصر التاريخ إعتمد الرجال لجلب قوتهم و التأقلم مع بيئتهم  على قوتهم و صلابتهم لمجاراة الطبيعة القاسية فكانت من تعابير تلك القوة و الصلابات أن لهم عضلات بارزة   فأصبحت من مظاهر الرجولة الشخص المعضل   فكلما كان الشخص منحوت العضلات فإنه يدل على قوة و صلابة هذا الشخص و فحولته       فهذا المظهر بقى مرتبطا الا عصرنا هذا  ,1,ثقافة
بما أننا على مشارف نهاية رمضان  ماهي تقاليد وتجهيزات العيد في ثقافة بلدك و أيها أحب إليك ,0,أهل ا خلود  وكل عام وأنت بخير   هناك العديد من التجهيزات التي تقام في مدينتي كعادات دائمة منها  تجهيز الكعك والمعمول وهذه أشهر العادات المرتبطة بالعيد على الإطلاق   إضافة للبدء بتجهيز ملابس العيد للأطفال وتجهيز وشراء الألعاب  وتجهيز توزيعات الحلويات التي توزع صباح يوم العيد   إضافة لتنضيف الشوارع والبيوت  وتزين البعض منها وليس الكل  ولكن من أجمل الطقوس هي أجواء الأسواق التي تكون تعلوها صوت التكبيرات  ,1,ثقافة
