Question,Subj_Q,Answer,Subj_A,Domain
كيف يمكنني إنشاء بودكاست  يسوق لنشاطي التجاري ,0,بما أن البودكاست هنا هدفه التسويق لنشاط تجاري قائم  فهذا يعني أن الجمهور المستهدف معروف ومحدد  تعرف مشاكلهم  احتياجاتهم وغالب ا تعرف شيئ ا عن تفضيلاتهم بحكم تحديد الإطار العمري وعليه  سوف تحدد سلف ا قائمة من المواضيع التي ترى أنها تمس جمهورك وتفيده ألاحظ على الكثير من صفحات الأنشطة التجارية ميزة مهمة جد ا وهي التواصل الدائم والفعال مع الجمهور  فلو أنك بنيت هذا التواصل  سيفيدك أكثر في الوصول إلى أهم المواضيع التي يمكنك أن تتحدث فيها  إذ يمكنك إجراء استفتاءات حول المواضيع المقترحة  استضافة مؤثرين يفضلهم جمهورك  وهكذا هناك فكرة لاحظتها في عدد من المنتجات من ضمنها القهوة مثل ا  تقدم العلامة التجارية المنتجة لهذه القهوة رعاية حلقات البودكاست لأحد المؤثرين  فيعرض لقطات وهو يحضر قهوته من هذا النوع خلال البودكاست دون أن يتحدث عنها أما بالنسبة للنصائح الفنية  فيمكنني أن أخبرك بعدة نصائح ,0,التسويق الالكتروني
التسويق بالعمولة Affiliate Marketing  كيف يمكنني تحقيق الربح منه ,0,ما هو المجال الذي تود العمل فيه  هل تسويق الخدمات أم المنتجات ,0,التسويق الالكتروني
شهر رمضان والتسويق  ماذا لو أنت صاحب مشروع كيف ستستغل قدوم الشهر للتسويق له ,0,رمضان موسم الخير والبركة وهذا ملاحظ حتى بالتسويق والبيع ومن يدرك كيفية عرض منتجاته أو خدماته  سيكون ربح بيعه  قبل أربع أيام سلمت خطة لزيادة أرباح نادي رياضي للسيدات خلال شهر رمضان  تعتمد على تجميد الاشتراكات الحالية واستكمالها بعد العيد  والقيام بدفع اشتراك جديد لمشتركات هذا الشهر و هم نوعان  من تريد أن تخسر وزن  ومن تريد أن تزيد  قمت بالتنسيق لمسابقة مدتها شهر لكل هدف على حدى و جعلت  عدد المشتركات محدود و سعر هذا الاشتراك أعلى من اشتراك الشهر العادي بنسبة ٣٥  و لكنه يشمل بكج اضافي  جلسة مساج  جلستين ساونا وبخار  جعلنا شعار الحملة  رمضان يحلينا و ركزنا على فكرة الوصول لإطلالة مميزة في عيد الفطر  اليوم اخبرتني مديرة النادي أن العدد قد اكتمل  في خطة أخرى شجعت ريادي أعمال يبلغ من العمر  ١٤ سنة على تقديم منتجات المخلالات بدلا  من منتجات الدوناتس التي يصنعها لأنه لن يكون قادرا على الانتاج خلال هذا الشهر  والمخلالات يبقى عليها طلب اكثر ويمكنه تجهيزها قبل فترة ووضعها في نقاط بيعية تأخذ نسبة محددة مثل سوبرماركت كبير أو بقالة  اقترحت عليه فكرة تصميم العبوة على شكل فانوس فإن لم يرغب الزبون بشراء المخلالات فإنه سيشتري من أجل الفانوس  إلا أنه لم يستطيع تنفيذها لضيق الوقت وعدم توفر معمل قادر على توفير هذه الكمية في الوقت الراهن  أشجع التجار على بيع السلع المركونة منذ فترة لديهم من خلال عمل بكجات تشجيعية تضم منتجات قديمة  ومنتجات حديثة بسعر معقول وتغليف مميز   من اجل ضرب عصفورين بحجر واحد   وخاصة أن الفترة الأولى من الشهر تكثر فيها الزيارات والهدايا  ,0,التسويق الالكتروني
حساب انستقرام خاص بعمل تجاري  كيف يمكنني الترويج له ,0,أهل ا بك يا صديق ةقبل الولوج في الإجابة عن السؤال المخصص بكيف يمكنني أن اروح للعمل التجاري  دعنا نتحدث حول ما ذكرت قلت أنك تنشر القصص اليومية والمنشورات   هل هي متخصصة وعلى مستوى من الكفاءة والجودة والتخصيص بحيث تنقل رسالتك بشكل دقيق تسعى لبناء علامة تجارية هذا لوحدة يحتاج لتفصيل كثير ا فكرة بناء العلامة التجارية وربطها في عقول عملائك أمر ا ليس بهين ويحتاج لبعض المثابرة فيجب أن تهتم بكل من  بالتأكيد الأن تطرح سؤال وما فائدتي من الأمر أنا أبحث عن ترويج ما ذكرت سابق ا أساس ا لترويج لا يمكنك أن تروج لنفسك بدون وجود علامة تجارية لديك وهوية خاصة بك  وبدون أن تكون قيمك واضحة ورسالتك وما تقدمه واضحة وإلا ستعمل على حملات ترويجية وستبوء بالفشل الأن يمكننا الانتقال لكيفية الترويج الناجح  بعد التأكد مما سبق وبأن تجربة العملاء مميزة وعلى مستوى من الجودةلا يمكن أن تستلم بسهولة لمجرد عدم الوصول السريع للأهداف أهم ما في الأمر التخطيط الصحيح والعمل على جميع النواحي بذات الوقت بعد الوصول لتكوين كيان علامة تجارية خاصة بك باختصار  فع لها كالفيروس في كل مكان  حتم ا ستجد نتيجة  ,1,التسويق الالكتروني
صفحة الهبوط  كيف يمكنني إنشائها لمنتج مشروعي ,0,لست خبيرة في انشاء صفحات الهبوط   لكن هناك بعض المعايير الهامة التي يجب ان يعرفها الجميع حتى غير المختصين أمثالنا  أفضل دوما في بداية اي مشروزع الكتروني يحتاج اللى برمجة أو إعداد رقمي   اللجوء الى متخصصين فعليين في المجال وصاحب خبرات مسبقة     كما يجب التعامل من خبير او التعلم الكامل لهذه الامور لكي يتسنى لك التدخل في اي وقت من حدوث عطل او مشكل    على العموم يجب اخذ الامور الاتية بالاعتبار بداية  ,1,التسويق الالكتروني
CPA ما هي  و كيف يمكنني الاستفادة منها  كمسوق مبتديء ,0,ي عد نموذج التكلفة لكل إجراء cost per action CPA أحد أنواع نماذج التسعير التي ترتبط بحملات التسويق عبر الهاتف المحمول بشكل شائع ويدفع فيها المسوقون لمصادر الوسائط وشبكات الإعلانات سعر ا ثابت ا مقابل إجراء محدد مسبق ا مثل بعض التحويلات التي تحدث داخل التطبيق بعد التعامل مع إعلان  يوجد العديد من الخيارات المختلفة مثل التسجيل  إطلاق التطبيق  وشراء بعض العناصر يساعد نموذج  التكلفة لكل نقرى  تكلفة الإجراء مصادر الوسائط على تلقي ميزانيات إعلانية من مسوقي الأداء لتحقيق القيمة الفعلية  كما أنها ت مثل انعكاس ا مباشر ا لربحية الحملات التي تترك حد ا أدنى من مخاطر التكلفة للمسوقين  مما يجعلها خيار ا واضح ا بين النماذج المتاحة للشركة ت حسب التكلفة الفعالة لكل إجراء effective cost per action  عن طريق قسمة التكلفة الإجمالية من تلك الشبكة  على العدد الإجمالي للإجراءات المحددة بناء  على نطاق زمني محدد مسبق ا  ويمنح الصورة الإجمالية لتكاليف الإعلان على مستوى مصدر الوسائط بمرور الوقت  إذ كلما زادت نقاط الاتصال قبل الحاجة إلى التحويل  زادت تكلفة الاستحواذ  ويمكن تتبع دفع التكلفة لكل إجراء بواسطة تحليلات جوجل ورموز القسائم يمكن تحقيق أقصى استفادة من دفع التكلفة بمجرد معرقة قيمة أعمال الفريق  تحديد الميزانية الإعلانية الصحيحةن والاستمرار في التحسين لخفض تكاليف كل إجراء حتى تعلم أن حملاتك التسويقية تؤتي ثمارها  ضبط حملات الدفع لكل نقؤة لخاصة بك  بهدف زيادة عدد التحويلات من خلال استهداف الجمهور المناسب ونشر قيمة العرض بوضوح لإغراء الأشخاص بالنقر فوق صفحة الهبوط  تخقيف الضغط على الرسائل الموجودة على صفحة الهبوط متسقة مع نص الإعلان الذي جذب انتباه الزائر ويجب أن يعمل جميع المحتوى والتصميم في الموقع بانسجام لقيادة المستخدم إلى نقطة التحويل  إعداد أهداف متعددة إضافية  مثل الوقت الذي تقضيه على الموقع أو عدد الصفحات التي تمت زيارتها  سيمنحك نظرة ثاقبة أفضل على المشكلات المحتملة مع صفحة الهبوط الخاصة بك  إذا كان المستخدمون يقضون وقت ا في تصفح موقع الويب الخاص بك  فربما لا تكون صفحة الوصول مقنعة بما يكفي أو يحتاجون إلى مزيد من الإثبات الاجتماعي لإجراء عملية شراء  مهما كان  يمكنك إصلاحه ,0,التسويق الالكتروني
سيارات بي أم دبليو  هل تعتقدون أنها علامة تجارية مميزة أم علامة تجارية فاخرة ,0,العلامات التجارية الفاخرة غالبا  لا تقارن نفسها بالعلامات التجارية المنافسة  كل علامة تجارية لها مكانتها الفاخرة ولكن عند مقارنتها بالمنافسين أنت تضعها في منافسة على أن  العلامة الفاخرة ترفض ذلك  ترفض هذه المنافسة   هذه العلامات تعرف جيدا  بأن  هذا لن يضر ها نهائيا   لإن  الرفاهية مرغوبة دائما   لسبب واحد وهو مهم  لأنها ترف  في ذلك يصبح السعر جزء ا من العملية لا أهم جزء  تتطلب العلامات التجارية الفاخرة ذات التكلفة المرتفعة جرأة في اختيار أعداد المقبولين والذين اشتروا القليلين  مما يؤدي فقط إلى زيادة الرغبة لدى الكثيرين عرض أقل تساوي طلب أقل على أن  البيع أعلى  هذه هي المعادلة التي تحكم الأمر  تختلف إستراتيجية العلامات التجارية اختلاف ا كبير ا عن العلامات التجارية الفاخرة  سيكون من الخطأ الكبير لأي نوع من العلامات التجارية محاكاة تسويق الآخر ولا يمكن للعلامات التجارية المتميزة أن تصبح علامات تجارية فاخرة بمجرد رفع أسعارها   ويجب ألا تحاول العلامات التجارية الفاخرة توسيع جاذبيتها في السوق المتميزة أو أنها تخاطر بفقدانها  ,0,التسويق الالكتروني
التخصص في المحتوى التسويقي للأعمال يمثل نسبة 50 في المئة من النجاح  ما رأيكم في ذلك ,0,لدي  مثال حي من واقعي الاجتماعي في هذا السياق يا مريم  ففي كل ية التجارة بجامعة القاهرة  على الرغم من ضخامة الصرح التعليمي واتساع شهرته وحصوله على شهادات موثوقة عديدة  تفض ل نسبة كاسحة اختيار شعبة المحاسبة في كل ية التجارة على شعبة إدارة الأعمال  وهذا يخبرنا بسقف توق عات مختلف المتعل مين داخل المؤس سات الأكاديمي ة  والحجة الأولى والأخيرة في هذا الصدد هي غزارة الفرص الوظيفي ة المتاحة لشعبة المحاسبة  من هنا نجد المشكلة الرئيسي ة  العقلي ة التي يتعامل بها المتعل مين مع رأس مالهم المعرفي  عقلي ة الموظ ف  لا رائد الأعمال ,1,التسويق الالكتروني
ما هي الحلول التي تساعدنا على مواجهة تغيرات الخواريزمية في استراتيجية التسويق بالمحتوى ,0,أتفق معك فيما طرحته وما يؤرق صناع المحتوى هو تغير هذه الخوارزميات وتحديثها المستمر  لكن الشيء الذي سيترك المتابعين يتابعونك مهما تغيرت الخوارزمية هو القيمة المضافة التي نقدمها كمحتوى لهم  فسيبحثون عنك حتى لو تأثرت بالخورازيمية ,1,التسويق الالكتروني
روح الدعابة في المزيج الترويجي  متى تساهم في جعل المزيج ناجحا ,1,المرح والفكاهة يمكن أن يعزز من إستراتيجيات التسويق التي نتبعها من خلال ومع ذلك لا أعتقد أن إستخدام الفكاهة بصفة دائمة ومستمرة أمر إيجابي على العلامة التجارية لذلك يجب إستخدامها بشكل مناسب  إستراتيجي ومتوافق مع أهداف الإعلان وفئة المنتج  كما يمكن أن تؤد ي الفكاهة إلى نتائج عكسية إذا كانت مسيئة  غير ذات صلة أو مبالغ فيها ,0,التسويق الالكتروني
هل التضحية بقنوات المبيعات الأخرى يمكن أن يساهم في زيادة المبيعات من الموقع الأساسي أو المتجر الرئيسي  ,0,لا أعتقد أنه يمكن أن نجيب عن هذا السؤال بجواب نعم أو لا  لأن  الأمر مرتبط بالعديد من العوامل  فهو يعتمد على المنتج المراد بيعه  السوق المستهدف  إستراتيجيتنا التسويقية  الميزانية المخصصة لذلك  المنافسة في السوق خاصة نقطة المنافسة  فمجال التجارة الإلكترونية يشهد منافسة قوية من المتاجر الأخرى خاصة الكبيرة منها  لذلك وإلى جانب النقاط التي ذكرتها في مساهمتك فإنه من المهم الإهتمام بالإستثمار في التصميم الخاص بتلك الصفحات والمتاجر فهي تلعب دورا هاما في جذب العملاء  التركيز على تطبيق تقنيات السيو والأمان وخدمة العملاء  وأمور كثيرة تتداخل فيما بينها كي تحقق تلك الزيادة ,0,التسويق الالكتروني
كيف يكون الترويج على طريقة نتفليكس ,0,الاعتماد على القصص المتعل قة بالتريندات المحل ية ومحاولات إنتاجها تمث ل واحدة من أبرز استراتيجي ات Netflix التي تلفت نظري  وذلك لأن الجميع يبحث دائم ا عن طريقة للتسويق لمنتجه  لكن هذه الآلية تقوم بعكس العملية  حيث أنها تخلق المحتوى المناسب للتريند بشكل عام  وفيما يخص هذه الاستراتيجي ة  يسعدني أن أستعيد برأي الصديق   Yazan_Izzeddin  نظر ا لاعتنائه الدائم بآليات التسويق الإلكتروني والمحتوى المختلفة ,0,التسويق الالكتروني
كيف تختلف الكتابة الإعلانية الوظيفية عن الكتابة الإعلانية للمنتج أو الخدمة ,0,يمكنني أن أقدم لك بعض الأفكار العامة حول ما يميل إلى جذب الأشخاص في الإعلانات ومنشورات الوظائف حسب خبرتي الخاصة فيما يتعلق بالإعلانات  غالب ا ما ينجذب الأشخاص إلى إعلانات جذابة بصري ا وسهلة الفهم وذات صلة باهتماماتهم أو احتياجاتهم  يمكن للإعلانات التي تقدم عروض قيمة فريدة  مثل   خصم 50  على أول عملية شراء لك   أن تجذب انتباه الناس أيض ا بالنسبة لإعلانات الوظائف  غالب ا ما ينجذب الأشخاص إلى الوظائف التي تتوافق مع أهدافهم المهنية وقيمهم الشخصية والتي تكسبهم إضافة جيدة لمستواهم وت مكنهم من التطور سريع ا ,0,التسويق الالكتروني
كيف يمكن أن تختلف حملة فيروسية viral campaign عن التراند  وهل تلتقيان أو لا علاقة بينهما ,0,الحملة الفيروسية VIRAL  هي انتشار شيء ما بسرعة وعلى نطاق واسع عبر الإنترنت  غالب ا من خلال وسائل التواصل الاجتماعي أو غيرها من المنصات عبر الإنترنت  عندما ينتشر شيء ما   فهذا يعني أنه اكتسب زيادة كبيرة ومفاجئة في الشعبية أو الاهتمام     الت رند TREND  هناك شيء ما شائع حالي ا أو يتم الحديث عنه كثير ا على الإنترنت  قد تكون قصة إخبارية أو أحد المشاهير أو منتج ا أو نوع ا آخر من المحتوى الذي يحظى باهتمام كبير في وقت معين  بشكل عام  الشيء الذي ينتشر بسرعة يكون له تأثير مفاجئ ودراماتيكي في حين أن الأمور الـ VIRAL قد تكون شائعة لفترة أطول من الوقت  وطبعا  هناك ملاحظة مهمة جدا  وهي أن ه  يمكن أن يكون لكل من المحتوى الفيروسي والترند تأثير كبير على الإنترنت ويمكن أن يتأثر كلاهما بعوامل مثل أهمية المحتوى وجودة المحتوى وتوقيت إصداره ,0,التسويق الالكتروني
هل الاحتفاظ بولاء العملاء صعب في المتاجر الرقمية وكيف يمكن حل ذلك ,0,علينا أن نفهم بداية  أن  المسألة باتت أصعب بكثير في هذه الفترة الحالية من العصر وهي تزداد  صعوبة مع كل لحظة نتقد مها فعلا  في الحياة ولكن لماذا  لإن  المسألة صارت  في أن  المنافسة تحو لت إلى شرسة جدا  مع تضخ م كبير في أعداد الشركات والمتاجر والشركات الناشئة الـ startups في الحياة  هذه المنافسة تستلزم صعوبة حقيقية في الحفاظ على العميل وذلك بسبب الخيارات الغير محدودة تقريبا  والمتوف ر عليها العميل في هذه اللحظة من عالمنا الم هتم بالانتاج والتسويق أكثر من أي عصر  أو وقت قد مضى على أن  ه ناك بعض الاستراتيجيات الناجحة أو التي تثبت أن ها أفضل من غيرها إلى الأن بالتعاطي مع هذه المسألة ,0,التسويق الالكتروني
هل التسويق الرقمي مناسب للشخصية الإنطوائية ,1,قرار ممتاز وخصوص ا أن هناك طلب كبير على هذا المجال في الآونة الأخيرة  ما تعريفك للانطوائية   أحيان ا الأشخاص يجهلون حقيقة أنفسهم بسبب رواج فكرة الانفتاح المبالغ بها   فأصبح الشخص الطبيعي يرى نفسه انطوائي بسبب الآخرين   مهارات تواصلك الضعيفة بتأكيد هناك سبب ما وهو عدم الخروج من دائرة الأمان والراحة لديك   مجرد القرار ان تمضي ق دما ستدرك أن لديك أمور كثيرة كنت تجهلها عن نفسك   نحن بحاجة للمغامرة للاكتشاف انفسنا   التسويق  مجالته كبيرة ومختلفة لا يمكن ان تحصر نفسك بزاوية   التعامل مع الأشخاص مباشرة   هناك عمل الحملات الإعلانية   التسويق عبر محركات البحث التسويق عبر شبكات التواصل الاجتماعي الإعلان المرئي التفاعلي  تسويق المحتوى   أنت تريد تعلم التسويق وليس تريد أن تصبح سلير في قسم المبيعات   يمكنك اختيار ما يناسبك وما يناسب مهاراتك وتطوير الامر   وفكرة مهارات التواصل أنصحك ,1,التسويق الالكتروني
التسويق عبر البريد الإلكتروني  كيف يمكنني إعداد حملة تسويقية من خلاله ,0,بداية يمكننا التعريف بالتسويق  عبر البريد الإلكتروني أنه يصف جميع الاتصالات التي ترسلها الم نشأة إلى جمهور مستهدف معين  العملاء  عن طريق البريد الإلكتروني  لأغراض التنقيب أو توفير المعلومات أو كجزء من برنامج ولاء العملاء وهناك أربع أنواع لتسويق عبر البريد الإلكتروني النشرات الإخبارية  الغرض منها هو الاحتفاظ بالاتصال المنظم مع العملاء الحاليين والمتوقعين  وتكون تحتوى على روابط لأحدث الموضوعات المنشورة   وهي الداعم الرئيس لأي استراتيجية تسويق محتوى جيد   تمام ا كما  يعمل مجتمع حاسوب بإرساله أهم وأبرز الموضوعات المتداولة في الأسبوع رسائل البريد الإلكتروني الخاصة بالمبيعات  هي تكون هادفة لتشجيع عملية البيع بالأساس للمنتج أو الخدمة الخاصة بك  ويكون في هذا النوع سهولة موافقة لدى المستلمين التي غالب ا تتطلبها اللائحة العامة لحماية البينات  كونها جزء من استراتيجية التسويق الداخلي  رسائل البريد الإلكتروني للمعاملات  هذه راسل B2B تكون من مرسل واحد   موقع لتجارة الإلكترونية  إلى مستلم واحد وهي أكثر أنتشار ا بواسطة مناصات  SaaSالتسويق الآلي عبر البريد الإلكتروني   هذه الرسائل التي تكون كبريد مخصص  غالب ا تكون مرسلة لمجموعة كبيرة من المستلمين وإليك أهم النصائح الفع الة للحصول على تسويق عبر البريد الإلكتروني ذو جدوى يمكننا الاستعانة بمعدل الارتداد لمعرفة أين نحن ذاهبون   يعني معدل الارتداد إلى النسبة المئوية لرسائل البريد الإلكتروني المرسلةفي الجملات التسويقية والتيلم يتم تسليمها إلى جهاتالمستهدفة   والسبب وراء ذلك إما بسبب عدم وجود عنوان بريد إلكتروني  ارتداد قوي    أو لأن صندوق البريد ذو ارتداد بسيط اي أنه غير متاح حالي ا   ,0,التسويق الالكتروني
