Question,Subj_Q,Answer,Subj_A,Domain
كيف يمكننا التسويق من خلال الوعي الجمعي أو الدليل الاجتماعي ,0,طريقة الوعي الجمعي في التسويق هي طريقة فعالة لكن للاسف هناك من يلجأ الى الكذب وافتعال قصص وآراء  زائفة لا اساس لها وعرض ارقام ومعطيات وهمية لا تمثل الحقيقة وهو ما يعرف بدمية الجورب على الانترنت حيث أصبحت تستخدم  للتسويق على الانترنت بشكل مهول        ,1,التسويق الالكتروني
كيف يمكننا استغلال العواطف  الحنين إلى الماضي  بالتسويق ,0,لدي توجه فكري ما في هذا الصدد  في البداية دعينا نعترف بأننا بالتأكيد في حاجة إلى هذه العقلية بشكل عام في مجال التسويق  حيث أن اللعب على وتر العاطفة والحنين إلى الناضي هو واحد من أنجح الطرق في هذا الصدد لكننا من جهة أخرى أمام مجموعة من العوامل المغايرة التي تجبرنا على تغيير عقليتنا بعض الشيء في هذا الصدد  وأبرز هذه العوامل هو التعامل مع جيل ما قبل الإنترنت سهوا كجيل مستهدف  فهذا يدفعنا إلى إهمال قطاع كبير من العملاء والمستخدمين من الأجيال الجديدة التي لا تنتمي لهذه الفئة العمرية  والتي تستمد شعورها بالنوستالجيا من ذكرياتها الخاصة  لا من الذاكرة التقليدية للأجيال التي سبقتها  وهذا يمنحنا مفهوما أكثر وضوحا عن أسباب فشل بعض الحملات الإعلانية التي نجحت في الماضي لشركات مثل بيبسي وكوكاكولا على سبيل المثال لا الحصر ,0,التسويق الالكتروني
استراتيجية تخفيض السعر واستراتيجية تقديم هدية مجانية أيهما الأكثر فاعلية ,0,مؤخر ا اصبحت قرارات الشراء لدي أكثر حكمة  فأصبحت لا اشتري إلا بعد التأكد التام من احتياجي للشيء  وإن أعجبني شيء أعمد إلى عدم الشراء الفوري ربما الجلوس أمام صورة الشيء فترة من الزمن ومراقبة تفكيري أثناء هذا  وهل سأظل في حاجه إليها أم هو هوس الشراء  أو أقوم بغلق الصفحة على أساس أنني لو في حاجة إليها بحق سأبحث عنها بنفسي بعد مدة  وبهذا تمكنت من تحويل سلوكي الشرائي من الاتجاه العاطفي إلى العقلاني  بين الحصول على الخصم أو الهدية  هذا يتوقف عندي على الشيئين فربما أعمد إلى الخصم إن كان كبير ا بحق  كأن اشتري هاتف من مصر ب 7 الاف جنيه  واستطيع الحصول عليه عن طريق قريب لي في السعودية مثلا ب 5 الاف   الهدية تستهويني بالطبع  ولكن بما انني شخص قلق وغير صبور فأفضل معرفتها من البداية  D وإن كان المشروع سيهاديني فالأفضل فعل هذا بدون اعلامي  هذا يكون وقعه أكثر فرح ا علي  حدث هذا معي وأنا اشتري لابنائي بعض الكتب والألعاب حيث قامت الصفحة التي اشتريت منها بارفاق عدة هدايا مع الطلب فوجئت بهم وانا افتح العلبة وكم كان فرح ا لا حد له 3 ,1,التسويق الالكتروني
التواصل من خلال chat bot يتسبب في خسارة المتجر الإلكتروني لعمليات البيع قبل بدايتها,0,بالنسبة لي أفضل كثيرا التواصل المباشر من خلال خدمة عملاء وليس من خلال الرد الآلي  أشعر باهتمام أكبر من قبل مقدم الخدمة فهو يهتم بي كعميل لدرجة أنه يخصص شخص يجاوب على أسئلتي واستفساراتي  على عكس الرد الآلي أيضا ديناميكية الحوار  والتي لا ألمسها بالرد الآلي أبدا  هناك حاليا مواقع توفر الخطوة الأولى من خلال الرد الآلي وبناء على الاستفسار يتم التواصل وتكملة الحوار عبر خدمة عملاء  نوعا ما هذا الدمج جيد بالتأكيد التواصل باستخدام الرد الآلي يوفر مميزات ويقلل النفقات للشركات فلن تكن مضطرة لتوفير عدد من الموظفين على مدار 24 ساعة  ولكن هل التكلفة التي يتم تقليصها أكبر من الخسارة عن استخدام الرد الآلي أعتقد بالمستقبل قد يلقى الرد الآلي أكثر فاعلية في حال تطور خوارزمياته بطريقة تعالج فكرة ديناميكية الحوار زيتون من البرامج المهمة لشركة حسوب  واستخدامه على المنصات وفر تجربة تواصل سريعة ومفيدة ومريحة بنفس الوقت,0,التسويق الالكتروني
التسويق الالكتروني وكيف يمكننا تحقيق الربح منه ,0,نسبة التواجد الرقمي للأفراد على الإنترنت أوجبت على الشركات التواجد في هذا الفضاء  في آخر الإحصائيات تقريبا 6 مليارات من سكان العالم يقضون في المتوسط بين 6 إلى 7 ساعات من يومهم على الإنترنت  هذه الأرقام الكبيرة تفرض على الشركات وأصحاب المشاريع بناء تواجد رقمي تنافسي قوي وليس فقط التواجد  عدم الحضور الرقمي وإهمال الشركة للتسويق الإلكتروني سيفقدها الكثير مجالات التسويق الإلكتروني متنوعة ومتعددة ولا يمكننا حصرها وكل مجال يتفرع إلى تخصصات لكن سنحاول ذكر الصورة العامة لكل مجال المجال هذا يشمل 3 تخصصات السؤال هذا إذا كنت تسأله كصاحب عمل فالربح منها يكون من خلال بناء حضور قوي على أهم المنصات التي يتواجد فيها جمهور المستهدف  وبهذا تقوم بالتسويق لعملك من خلال المحتوى الذي تنشره أو الإعلانات الممولة وتكون قريب جدا مع عملائك والمميزة في التسويق الإلكتروني هو عملية الاستهداف الدقيقة للعملاء والميزانية الأقل التي يتم استهلاكها مقارنة مع التسويق التقليدي  وفي منصة خمسات ومستقل تجد العديد من المستقلين الذين يساعدونك في المهمة أما إذا كنت تسأل كشخص عادي وتريد تحقيق دخل من هذا المجال  بداية أنصحك باختيار مجال واحد للتخصص فيه لأن المجالات صراحة متفرعة وواسعة  تحتاج جهد ودراسة وبحث التسويق عبر محركات البحث يمكنك تحقيق الربح منه من خلال كتابة المحتوى أو التخصص في الباكلينكس  أو حتى التخصص في البحث عن الكلمات المفتاحية وضع الخطط الاستراتيجية للمواقع   أو التخصص في الإعلانات الممولة  في خمسات يوجد العديد من الأشخاص الذين يقدمون خدمة واحدة فقط في التخصص ومع الوقت يمكنك التفرع في المجال أو يمكنك تصميم موقع خاص بك وكتابة محتوى بعدها دفع على جوجل أدسنس حتى تتمكن من الربح من نشر الإعلانات عليه  أو حتى تقديم خدمة الجيست بوست المقال الضيف على موقع لبضعة أيام من أشخاص يريدون الترويج لخدماتهم ومواقعهم وكل مجال يمكنك تعلمه سيساهم في حصولك على دخل وكلها مطلوبة  مثلا التسويق عبر منصات التواصل الاجتماعي تعلم إدارة هذه المواقع وإنشاء الخطط  كتابة المحتوى  كتابة الإعلانات   الخ التسويق بالعمولة يمكنك الربح منه من خلال التسجيل في المتاجر الإلكترونية مثل أمازون وتصميم متجر وعرض المنتجات في متجرك  أو التسجيل في برنامج خمسات للتسويق بالعمولة       التسويق بالعمولة لموقع خمسات  khamsat com affiliates برنامج خمسات للتسويق بالعمولة والربح من الإنترنت  اربح من خلال التسويق بالعمولة لموقع خمسات      برنامج خمسات للتسويق بالعمولة والربح من الإنترنت  اربح من خلال التسويق بالعمولة لموقع خمسات والتسويق لخدمات المستقلين وهذه الإجابة للربح بالمختصر فقط حتى لا أطيل عليك  ,0,التسويق الالكتروني
حماية البيانات الشخصية أمر ممكن أو مجرد اتجاه تسويقي جديد من آبل,0,أرى أن ذلك مستيحل ببساطة  لأننا لا يمكننا القيام بهذا في إطار مجموعة من الخطوات التي تتبن اها الأجهزة نفسها  يمكننا ان نضرب مثل ا بذلك ما يتم الموافقة عليه أو طلب الموافقة عليه من قبل أي موقع إلكتروني  وهو استقبال الـCookies المتعل قة باستخداماتنا على الإنترنت  لا يخلو أي موقع من السؤال على ذلك  ويعتبر هذا دليل ا قاطع ا على كون هذه المسألة مشتركة بين جميع المواقع  إذا نحن في هذه الحالة أمام أمر مرتبط بالمنصات التي نتعامل معها  والمواقع التي نقوم بزياراتها  وإذا كان جهاز آبل في هذه الحالة قادر ا على حصر عملية تبادل البيانات من خلاله  فإنه ليس صاحب القرار أصلا حيال المسألة نفسها على المنصات والمواقع ,0,التسويق الالكتروني
ما هو تقييمكم لاستخدام المحتوى التعليمي كأداة تسويقية ,0,سأشارك رأيي بصفتي مستهلكة وم قد مة خدمات أ روج لها بهذه الطريقة كمستهلكة أرى أن  هذه طريقة مدهشة للتسويق  لأنها تحفز الناس على البحث أكثر حول الخدمات المقدمة والإستفسار حول أسعارها أو الخدمات الأخرى الم قدمة  وأرى أنها سبب في إنشاء علاقة ثقة متبادلة بين العميل ومقدم الخدمة  وذلك من خلال فحص العميل لجودة الخدمة وشراءها وهو متيقن وراض  عن ما سيتلقاه  وأتحدث عن الأمر من خلال تجارب طويلة في الإنسياق نحو التكتيكات التسويقية التي شدتني لشراء منتجات وخدمات محددة كم قدمة خدمات أقوم بالفعل بالترويج لدوراتي من خلال هذه الطريقة  فمثل ا أ قدم محاضرة تقديمية مجان ا لكي يتأكد العملاء أنهم سيلقون الخدمة التي رسموها في عقولهم عند إستفسارهم حول الدورة التدريبية وأسعارها وما إلى ذلك  وكما قلت فإن تقديم عينات مجانية للعملاء يجعلهم أكثر ثقة بالبائع  وأكثر إهتمام حول تفاصيل الخدمة,0,التسويق الالكتروني
تطبيق ويزو wizzo  هل هو أداة تسويقية لقنوات mbc ,0,بالنظر لتطور الألعاب الرقمية وحب الشباب للبقاء في داخلها  أرى أنها خطة جيدة للتسويق عبرها  لأن الإعلان سيصل للفئة المناسبة  الشباب على الأغلب  ولأنهم أكثر فئة تتحمس لمشاهدة كل ما هو جديد ومشاركته مع الآخرين  فذلك يؤدي إلى نجاح طريقة التسويق عبر الألعاب كما ذكرت  مع أنها فكرة جديدة وغير مألوفة إلا أننا أصبحنا نصادفها كثير ا في أكثر من لعبة مثل لعبة ببجي التي تقوم بتحميل شخصيات للاعبين رياضيين أو مغنين وما إلى ذلك  لذا بنظري فهي خطة تسويقية رائعة وتحقق الهدف المطلوب ,0,التسويق الالكتروني
كيف تطبق الشركات نظرية  قطعة الجبن  و المصيدة  ,0,أنا لم أجربها حقيقة  لكنني دائم ا أقع في المصيدة  فأأخذ عينات مجانية للعطور وواقي الشمس ومرطبات البشرة وأعود وأشتري منها  لذا فأؤكد أنها استراتيجية ناجحة وتشعرني بأن هذه العلامة التجميلية موثوقة ولا تود خداعي فتقدم لي عينة صغيرة مجانية يمكنني الاستفادة منها ,1,التسويق الالكتروني
التسويق العصبي  كيف يؤثر على قراراتنا الاستهلاكية  ,0,ألاحظ التسويق العصبي كثيرا في الاشهارات التلفزيونية  فهي تعتمد بدرجة كبيرة على اثارة مشاعر المشاهد و جذب احساسه لشعور بأن المنتج قد انتج له خصيصا وعليه  كثيرا ما يخاطب التسويق العصبي العقل الباطن هو ما نشعر بأنه تأثر بالمنتج وجلبه الينا  والعقل الواعي يستفيق بعد ان تتحقق عملية الشراء لنتساءل كيف بإمكاننا ان نشتري هذا المنتج لذلك من بين الامور المساعدة في اختيار المنتج بوعي هي ,1,التسويق الالكتروني
العقل اللاواعي هو المسؤل عن عملية الشراء  فكيف نخاطبه ,0,الامر أشبه بتجهيز المستهلك ذهنيا وتهيئته لاتخاذ قرار الشراء  لكن وفق هذه الاستراتيجية ديما  أي نوع من أنواع المحتويات المرئي أو المكتوب من يمكنه التأثير أكثر على سلوك المستهلك هل يمكن توضيح ذلك بمثال ,0,التسويق الالكتروني
كيف يمكنني بناء تصور أولي  عن الفئة التي علي استهدافها ,0,الموضوع لا يحتاج لكثير من التعقيد في البداية يا خالد  يمكنك البدء بنموذج بسيط كبداية وليس تفصيلي أهم ما تحتاجه لبناء صورة العميل المحتمل target persona هو تحديد البيانات الجغرافية  في أي مدينة أو بلد يعيش  والبيانات الديموغرافية  مثل سنه ومهنته وما إلى ذلك والمواقع التي يزورها  وهنا حسب منطقته الجغرافية وحسب سنه  إن كان من دول الخليج فغالب ا يستخدم تويتر  ولو كان من دول أخرى فغالب ا فيسبوك  ولو كانوا صغار السن فغالب ا انستجرام أو تيك توك  وان كانت خدماتك موجهة لأعمال تجارية فغالب ا لينكد إن  لا تحتاج لمعرفة المواقع بالتحديد التي يزورها  ومن الصعب معرفة ذلك في البداية وأهدافه  التي يمكنك تحقيقها له من خلال عملك   هذه أهم البيانات التي تحتاجها لنأخذ مثال ا  انت الان مسوق الكتروني  فالعميل المستهدف بالنسبة لك سيكون صاحب عمل تجاري يقطن في    البلد التي تستهدفها   وعمره   غالب ا أعلى من 25   ويستخدم موقع  حسب دولته وسنه كما ذكرنا   وأهدافه  أنه يريد زيادة مبيعاته هذا مثال بسيط  صحيح نادر ا ما تجد احصائيات في الوطن العربي  ولكن يمكنك معرفة الاحصائيات على المستوى العالمي واسقاطها على العالم العربي  بالاضافة للاعتماد على ملاحظاتك  من المنافسين كمثال  أو تخميناتك الشخصية إلى حين بناء بعض من جمهورك وسيصبح الأمر أسهل ,1,التسويق الالكتروني
ريان والتسويق العاطفي   ما رأيك ,0,اعتقد ان الانسان الذي يمتلك هدفا نبيلا   ويسعى لينقل فكرة  الى عقول واعية  لن يستغل الالام او الافراح ليجمع الجمهور على فكرته  لكن التجارة بالالام لاجل تحقيق ربح ذاتي ليست بحد ذاتها هدفا نبيلا  الفكرة النبيلة التي يحتاج صاحبها لينشرها بين بني البشر  ساعيا ليغير من الافكار بهدف الفكرة فقط  الفكرة وحسب  لن يقوم صاحبها هذا باستغلال اي الم بشكل غير مبرر يمكنك ان تنقل الام البشر  أو الشعوب لتعبر عن اضطهادهم  أو معاناتهم  لانك تريد ان يعلم البشر كيف يعانون  وكيف تسرق حقوقهم  لكنه ليس نبيلا ان تستغل معاناتهم لنشر فكرة مبطنة تود ان تجمع عليه جمهورا واتباعا  واظن  ان الشخص الذي يقوم بهذا  يدرك تماما ايضا ان غالبية تنساق لعوطفها   بعيدا عن احكام عقولها  افضل جماعة يمكن الاستفادة من كثرتها  والكثرة غالبا منساقة لا تعي  والنجوم في السماء متناثرة في ظلام اسود  تشبه العقول النيرة في الجموع الغافلة ,1,التسويق الالكتروني
تسويق حرب العصابات  غوريلا ماركتنج  هل سمعت به من قبل ,0,بالتأكيد استخدام أساليب وتفاعلات مفاجئة و غير مألوفة في التسويق عامل في نجاح المنتج  كما يترك انطباع ا وأثر ا لدى الناس حوله  وهذا ما يميز استراتيجية تسويق الغوريلا أتذكر أتتي نناولت هذه الاستراتيجية في مساهمة فيما سبق  لفتت نظري بشكل كبير  أنها تكتيك تسويقي مقنع ولا تحتاج إل تمويل كبير  أيضا شركة كوكا كولا Coca Cola    اعتمدت في بعض حملاتها الإعلانية على هذه الاستراتيجية قال عنها الكاتب جي كونراد ليفينسون  يمكنني وصف روح الغوريلا ماركيتنغ على أنها تحقيق الأهداف المألوفة مثل الربح والاستمتاع من خلال طرق  غير تقليدية  كاستخدام الطاقة الجسدية بدل ا من النقود  ,1,التسويق الالكتروني
كيف يمكن تجنب النتائج العكسية في التسويق ,0,صحيح  فكما يقول المثل كل شيء يزيد عن حده ينقلب الي ضده  هذا المثال يمكن تطبيقه في كل المجالات ومن بينها التسويق  ولنطبقها اولا علي الانسان  فالانسان اذا افرط في تناول الاطعمة يصاب بالامراض واذا افرط في شرب الماء بشكل يزيد عن الحد قد يصاب بالتسمم  كذلك الامر يمكن تطبيقه علي شخصية الانسان  فالطفل الذي يقوم ذويه بالاهتمام الزائد به يصبح شخصا ضعيف الشخصية  ايضا فان كثرة الانتقاد تقتل الابداع  وكثرة الرقابة تسلب الطفل هويته  نطبق ذلك المبدا علي وظيفة التسويق  نجد ان كثرة الالحاح علي العميل بشكل مفرط لجعله يسلك توجها معين  جعل الامر ياتي بنتائج عكسية   ,1,التسويق الالكتروني
ماهي نصائحكم اريد انشاء صفحة فيس بوك لبيع منتجات طبيعية  ,0,أفضل الانستغرام على الفيس بوك  عموم ا قبل انشاء الصفحة لابد من اختيار عنوان جذاب وم لفت لها  ابتعد عن التعقيد  ربما العنوان القصير والمبسط هو الأفضل لمثل هذه الصفح أرفق صور وفيديوهات للمنتجات  لعل الفيديو أكثر شيء يلفت المشاهد  فهناك أبحاث ودراسات تخبرنا بأن المشاهدين يفضلون تصفح الفيديوهات بشكل كبير  بالطبع الفيديو لابد أن يكون قصير ضع وصف للمنتج بأسلوب مقنع  يمكنك التواصل مع كتاب لهم خبرة في الكتابة التسويقية  أيض ا ذكر  فوائد المنتج والعلامة التجارية مهم  اطلب من أصدقائك على وسائل التواصل بأن يشتركوا في الصفحة كما أطلب منهم أن يتواصلوا مع أصدقائهم أيض ا حتى يشتركوا في الصفحة حاول أن تضع أسعار المنتجات في الصفحة وأترك وسيلة تواصل بينك وبين من يتابعون صفحتك ,0,التسويق الالكتروني
أي المنصات أستهدف للترويج لمشروعي ,0,بالتأكيد كل المنصات التي ذكرتها تصلح لترويج لمشروعك  لكن لو كنت مكانك على ركزت على منصتين فقط وهما  اولهما الفيس بوك  وثانياا تطبيق التيك توك اصبح شائعا في الفترة الاخير بشكل رهيب بين المستخدمين  قدم هذا التطبيق اضافة في تقريب المشتري من المنتج  كانه موجود امامه  وايضا يضمن لك ان مستخدم هذا التطبيق سيمر عليه  ستقول لي حتى فيس بوك و انستغرام يوفر هذه الخاصية  لماذا التيك توك بذات  المستخدم يملك خاصية واحد عند ولوجه له  غير ان انستغرام يوفر للمستخدم الاطلاع على اشياء اخرى في ان واحد  لذلك احيانا قد لا يركز مع المقطع الذي مر عليه  ما رأيك في الامر  ,0,التسويق الالكتروني
تصميم شخصية العميل  لماذا هي بهذه الأهمية ,0,اهتمامات العميل ورغباته والمشاكل التي يريدون ايجاد حل  لها   تعتبر من أهم الأمور التي يجب التنبه إليها وأخذها بالحسبان لأنها  ستساهم في شكل كبير في اخراج العمل او المشروع والتسويق له وفق مايرضي رغبة العميل ,1,التسويق الالكتروني
تعرف على منصة المعلومات الأكبر في العالم Wikipedia,0,كل هذه المعلومات جيدة  لكن هناك سؤال يؤرقني دائم ا ككاتب محتوى  وهو معلومات ويكيبيديا  حيث أن الكثير من العملاء يرفضون أي معلومات من ويكيبديا ولا يعتمدونها كمصدر في أي من المقالات البحثية  وهذا الأمر يجعلني دائم ا أتجاهل المعلومات الموجودة فيها وأعتبرها معلومات سطحية أو ليست حقيقية بصورة تامة لذلك سؤالي المباشر  هل ويكيبديا موقع موثوق للمعلومات أم أنه مجرد مقالات واجتهادات شخصية من أشخاص حول العالم ولا يوجد توثيق لجميع هذه المعلومات ,0,التسويق الالكتروني
هل التسويق بالبريد الالكتروني هو الطريقة الأسرع في النتائج  ,0,ما مصدر هذه الاحصائي ة  لا أظنها واقعي ة أبد ا ,1,التسويق الالكتروني
